english,japanese,detail,sample
quite,全く,程度がかなり大きいこと。完全に、かなりの両方がある。 ,"The teacher asked about the quite after class."
attempt,試み；～を試みる,「試み；～を試みる」という動き・変化を表す語。人・物への働きかけを表す。 ,"A photo showed the attempt beside the road."
performance,遂行,実際に行った結果。演技・業績・性能にも使う。 ,"The committee discussed performance for an hour."
cross,十字架,「十字架」という動き・変化を表す語。人・物への働きかけを表す。 ,"The report connected the cross to the case."
probably,たぶん,根拠がある「たぶん」。maybeより可能性が高め。 ,"The ferry will probably leave at noon."
accept,～を受け入れる,「～を受け入れる」という動き・変化を表す語。人・物への働きかけを表す。 ,"Accept the offer before Friday."
additional,付け加えた,すでにあるものに加える性質。追加の、さらなる。 ,"The team chose an additional route."
compare,～を比較する,「～を比較する」という動き・変化を表す語。人・物への働きかけを表す。 ,"Compare the two photos side by side."
prepare,～を準備する,「～を準備する」という動き・変化を表す語。人・物への働きかけを表す。 ,"Prepare the room for guests."
raise,～を上げる,「～を上げる」という動き・変化を表す語。人・物への働きかけを表す。 ,"Raise your hand before speaking."
operate,動く,「動く」という動き・変化を表す語。人・物への働きかけを表す。 ,"The checklist included the operate at the end."
express,～を表現する；急行の,「～を表現する；急行の」という動き・変化を表す語。人・物への働きかけを表す。 ,"He can express his feelings clearly."
opinion,評価,人が持つ考えや判断。意見・見解を表す。 ,"The teacher asked about the opinion after class."
seek,～を探し求める,「～を探し求める」という動き・変化を表す語。人・物への働きかけを表す。 ,"They seek help from a doctor."
sound,音,「音」という動き・変化を表す語。人・物への働きかけを表す。 ,"The manual listed the sound under tools."
official,公式の；公務の,公に認められた状態。公式の・公務上の意味で使う。「公務の」の意味もある。 ,"The committee made an official decision."
military,軍隊の,「軍隊の」という性質を表す語。人・物・状況の様子を表す。 ,"The team chose a military route."
opportunity,機会,何かをするよい機会。chanceより前向きな場面が多い。 ,"Her essay connected opportunity with daily life."
