id,english,japanese,detail,sample,sample-jpn
b1-part5-0181,sportsmanship,スポーツマンシップ,正々堂々のスポーツマンシップ。フェアな精神を指す。,"Good sportsmanship matters more than winning.",スポーツマンシップは勝つことよりも大切だ。
b1-add1-0156,windscreen,フロントガラス,車の前面のフロントガラス。主に英で用いる語(米ではwindshield)。,"Rain hit the windscreen hard.",雨がフロントガラスを激しく打った。
b1-add1-0226,appetizer,前菜、食前酒,食欲をそそる前菜。食事の最初に出る一品を指す。,"We shared an appetizer before dinner.",私たちは夕食前に前菜を分け合った。
b1-part5-0018,carelessly,不注意に,「不注意に・うっかり」を表す副詞。無頓着な様子を示す。,"He carelessly dropped the glass on the floor.",彼は不注意にもグラスを床に落とした。
b1-add1-0015,barman,バーテンダー,バーで酒を出すバーテンダー。主に英で用いる語。,"The barman poured two drinks.",バーテンダーが二杯の飲み物を注いだ。
b1-part5-0119,schoolteacher,先生,学校で教える先生。教員を指す。,"The schoolteacher read a story.",学校の先生が物語を読んだ。
b1-part4-0110,narrate,～を語る,順を追って語るイメージ。物語る・ナレーションする意味で使う。,"She will narrate the documentary.",彼女はドキュメンタリーのナレーターを務める予定だ。
b1-part5-0151,penniless,無一文の,お金のない無一文の様子。文なしのイメージ。,"He was penniless after the trip.",旅行の後、彼は一文無しだった。
b1-part5-0069,friendliness,友人らしさ,親しみやすさ・友好。友人らしさを指す。,"Her friendliness made the new student feel welcome.",彼女の親しみやすさが新入生を歓迎させた。
b1-part5-0071,innermost,いちばん奥の,いちばん奥の・最も深い様子。心の奥底のイメージ。,"She shared her innermost feelings.",彼女は最も内なる気持ちを打ち明けた。
b1-add1-0221,amenity,快適な設備、アメニティー,暮らしを快適にする設備。ホテルの備品を指すこともある。,"The apartment has many amenities.",そのアパートには多くの設備がある。
b1-part5-0162,brainstorming,ブレーンストーミング,自由に意見を出し合うブレーンストーミングを指す語。,"The team held a brainstorming session.",チームはブレインストーミングセッションを行った。
b1-add1-0262,caterer,仕出し業者、ケータリング業者,料理を届け提供する仕出し業者。宴会の料理を請け負う人を指す。,"We hired a caterer for the party.",私たちはパーティーのために仕出し業者を雇った。
b1-part5-0064,doze,うたた寝する,うとうとうたた寝するイメージ。まどろむ意味で使う。,"I sometimes doze on the train.",私は電車の中で時々うとうとする。
b1-add1-0089,hurriedly,あわてて、急いで,せかせかと急いで、を表す副詞。あわただしい様子を示す。,"She hurriedly packed her bag.",彼女はあわててかばんに荷物を詰めた。
b1-add1-0004,aerobics,エアロビクス,音楽に合わせて行う有酸素運動のエアロビクス。健康体操を指す。,"She does aerobics twice a week.",彼女は週に二度エアロビクスをする。
b1-part5-0046,involuntarily,いやいやながら,「いやいや・思わず」を表す副詞。意志に反する様子を示す。,"His hand moved involuntarily.",彼の手は無意識に動いた。
b1-part6-0104,entitle,～に権利を与える,権利や資格を与えるイメージ。表題をつける意味にも使う。,"This ticket will entitle you to a discount.",このチケットで割引を受けることができます。
b1-part5-0166,procrastination,先延ばし,すべきことの先延ばし。ぐずぐずすることを指す。,"Procrastination makes homework harder to finish.",先延ばしにすると宿題がより難しくなる。
b1-add1-0233,attendee,出席者、参加者,会などに出席する参加者。出席する側の人を指す。,"The conference had 300 attendees.",その会議には300人の参加者がいた。
b1-part5-0047,glint,きらりと光る、きらめき,きらりと光ること・きらめき。ちらっと光る動詞にも使う。,"A glint of light flashed from the metal.",金属からひらめきのような光が閃いた。
b1-part4-0190,carelessness,不注意,気配りに欠ける不注意。うっかりを指す。,"Carelessness can cause accidents.",不注意は事故を引き起こすことがある。
b1-add1-0147,uninteresting,おもしろくない、退屈な,興味を引かない退屈な様子。味気ないイメージ。,"The lecture was long and uninteresting.",その講義は長くて退屈だった。
b1-part5-0165,thunderous,雷の,雷のようにとどろく様子。轟音の・激しいイメージ。,"The crowd gave thunderous applause.",観衆は雷鳴のような拍手を送った。
b1-add1-0145,unafraid,恐れない、平然とした,こわがらず恐れない様子。ひるまないイメージ。,"She was unafraid to speak the truth.",彼女は恐れず真実を口にした。
b1-add1-0204,underlie,～の根底にある,表面の下に潜みその根底にあるイメージ。基礎となる意味で使う。,"Strong values underlie her decisions.",確かな価値観が彼女の決定の根底にある。
b1-add1-0149,uplifted,気分が高揚した、高められた,気持ちが引き上げられ高揚した様子。晴れやかなイメージ。,"The music left the crowd uplifted.",その音楽は観衆を高揚させた。
b1-part5-0100,environmentalist,環境保護論者,自然を守る環境保護論者を指す語。,"The environmentalist planted trees along the river.",環境保護活動家が川沿いに木を植えた。
b1-part4-0094,photocopy,～を写真複写する,原本を写真複写するイメージ。コピーをとる意味で使う。,"Please photocopy this page.",このページをコピーしてください。
b1-part6-0010,tracksuit,トラックスーツ,運動時に着るトラックスーツ。ジャージを指す。,"He wore a tracksuit to practice.",彼は練習にトラックスーツを着ていた。
b1-part2-0160,pollutant,汚染物質,環境を汚す汚染物質。公害物質を指す。,"Smoke is a major pollutant.",煙は主要な汚染物質だ。
b1-part5-0144,untidy,だらしがない,散らかっただらしがない様子。乱れたイメージ。,"His desk was untidy.",彼の机は散らかっていた。
b1-add1-0117,paralyze,麻痺させる、まひさせる,体や機能を動かなくする動詞。すくませる・停止させる意味も。米式つづり。,"Fear paralyzed him for a moment.",恐怖が一瞬彼をすくませた。
b1-part6-0012,wristwatch,腕時計,手首につける腕時計を指す語。,"My wristwatch stopped at noon.",腕時計が正午に止まった。
b1-add1-0049,easygoing,のんきな、おおらかな,あくせくしないおおらかな様子。気楽で寛容なイメージ。,"He is easygoing and rarely gets angry.",彼はおおらかでめったに怒らない。
b1-part6-0001,mountaintop,山頂,山のいちばん上の山頂。頂上を指す。,"Snow covered the mountaintop.",雪が山頂を覆った。
b1-add1-0096,interviewee,面接を受ける人、被面接者,面接や取材を受ける側の人。質問される人を指す。,"The interviewee answered calmly.",面接を受けた人は落ち着いて答えた。
b1-part5-0067,overwork,働きすぎる、酷使する,度を越して働きすぎるイメージ。酷使する意味にも使う。,"Do not overwork yourself before the exam.",試験前に無理をしてはいけない。
b1-part4-0173,adverb,副詞,文法・語形成の用語。「副詞」として語や文の働きを表す。 ,"An adverb can modify a verb.",副詞は動詞を修飾することができる。
b1-part5-0192,pullover,プルオーバー,頭からかぶるプルオーバー。かぶり式のセーターを指す。,"She wore a warm pullover.",彼女は温かいプルオーバーを着ていた。
b1-part4-0050,devastate,～を壊滅させる,徹底的に壊滅させるイメージ。荒廃させる・打ちのめす意味にも。,"The earthquake can devastate the city.",地震はその都市を壊滅させる可能性がある。
b1-part5-0021,participle,分詞,文法・語形成の用語。「分詞」として語や文の働きを表す。 ,"A participle can work like an adjective.",分詞は形容詞のように働くことができる。
b1-add1-0011,backpacker,バックパッカー,荷物を背負って安く旅する旅行者。自由な個人旅行者を指す。,"The hostel is popular with backpackers.",その宿はバックパッカーに人気だ。
b1-add1-0046,dustbin,ごみ箱,ごみを入れるごみ箱。主に英で用いる語(米ではtrash can)。,"Throw it in the dustbin.",それをごみ箱に捨てなさい。
b1-part5-0129,immigrate,移住する,他国へ移り住むイメージ。移住してくる意味で使う。,"His grandparents decided to immigrate to Canada.",彼の祖父母はカナダへ移住することを決めた。
b1-part5-0146,noisily,やかましく,「やかましく・騒々しく」を表す副詞。音の大きさを示す。,"The children played noisily outside.",子どもたちは外でうるさく遊んでいた。
b1-part4-0198,preposition,前置詞,文法・語形成の用語。「前置詞」として語や文の働きを表す。 ,"In is a common preposition of place.",「in」は場所を表す一般的な前置詞だ。
b1-part5-0059,infinitive,不定詞,文法・語形成の用語。「不定詞」として語や文の働きを表す。 ,"To run is an infinitive phrase.",「走ること」は不定詞句だ。
b1-part6-0006,sundial,日時計,影で時を知る日時計を指す語。,"A sundial uses the sun to show time.",日時計は太陽を使って時間を示す。
b1-part4-0079,fascinate,～を魅了する,心を強く引きつけ魅了するイメージ。うっとりさせる意味で使う。,"Space travel can fascinate children.",宇宙旅行は子どもたちを魅了することがある。
b1-add1-0061,feverishly,熱に浮かされたように、必死に,熱っぽく・興奮して、を表す副詞。あわただしいイメージ。,"They worked feverishly to finish on time.",彼らは間に合わせようと必死に働いた。
b1-part5-0136,signpost,道しるべ,方向を示す道しるべ・道標。手がかりの比喩にも使う。,"The signpost pointed to the village.",道標が村への方向を示していた。
b1-add1-0199,situate,位置させる、置く,ある場所に位置づける動詞。据える・関連づける意味で使う。,"The hotel is situated near the beach.",そのホテルは浜辺の近くにある。
b1-add1-0081,hairdryer,ヘアドライヤー,髪を乾かすヘアドライヤー。温風を出す器具を指す。,"She dried her hair with a hairdryer.",彼女はドライヤーで髪を乾かした。
b1-add1-0157,windsurfing,ウィンドサーフィン,帆のついた板で水上をすべるウィンドサーフィン。海の運動を指す。,"We tried windsurfing on the lake.",私たちは湖でウィンドサーフィンを試した。
b1-part5-0175,addressee,受信人,郵便などの受信人・あて名人。受取人を指す。,"Write the addressee's name on the envelope.",封筒に受取人の名前を書きなさい。
b1-part5-0140,retell,～を再び語る,話を再び語るイメージ。語り直す意味で使う。,"Retell the story in your own words.",自分の言葉でその話を語り直しなさい。
b1-part5-0190,flunk,落第する、～に落第点をつける,試験に落第するイメージ。落第点をつける意味にも使う。,"He may flunk the exam if he does not study.",勉強しないと試験に落ちるかもしれない。
b1-part5-0173,schoolmate,学友,同じ学校の学友。同窓生を指す。,"I met an old schoolmate.",昔の同級生に会った。
b1-part5-0199,sunbathe,日光浴をする,日ざしを浴びる日光浴をするイメージ。ひなたぼっこする意味も。,"Tourists sunbathe on the beach.",観光客が浜辺で日光浴をしている。
b1-part5-0179,backache,背の痛み,背中や腰が痛む背の痛み・腰痛を指す語。,"A long drive gave him a backache.",長時間の運転で腰痛になった。
b1-part3-0165,inscribe,～を刻む、記す,文字を刻み記すイメージ。献辞を書く・登録する意味にも使う。,"They will inscribe her name on the trophy.",彼らは彼女の名前をトロフィーに刻む予定だ。
b1-add1-0030,courgette,ズッキーニ,細長い夏野菜のズッキーニ。主に英で用いる語(米ではzucchini)。,"I added courgette to the soup.",私はスープにズッキーニを加えた。
b1-part6-0002,earache,耳痛,耳が痛む耳痛を指す語。,"The child had an earache.",子どもは耳が痛かった。
b1-part5-0139,adverbial,副詞の,文法・語形成の用語。「副詞の」として語や文の働きを表す。 ,"The sentence has an adverbial phrase.",その文には副詞句が含まれている。
b1-part4-0146,horrify,～をぞっとさせる,ぞっとさせるイメージ。強い嫌悪や恐怖を与える意味で使う。,"The violent scene may horrify viewers.",そのバイオレントなシーンは視聴者を恐怖に陥れるかもしれない。
b1-add1-0001,aborigine,先住民,その土地に古くから住む先住民。特に豪州の原住民を指す。,"The museum shows aborigine art.",その博物館は先住民の芸術を展示している。
b1-part2-0153,accustom,～を慣れさせる,慣れさせるイメージ。習慣づける意味で使う。,"It takes time to accustom a child to a new school.",子どもを新しい学校に慣れさせるには時間がかかる。
b1-part5-0167,antonym,反意語,文法・語形成の用語。「反意語」として語や文の働きを表す。 ,"Hot is an antonym of cold.",「hot」は「cold」の反意語だ。
b1-add1-0126,reunify,再統一する,分かれたものを再び一つにする動詞。統合する意味で使う。,"The two regions were reunified.",二つの地域は再統一された。
b1-add1-0254,businessperson,実業家、ビジネスパーソン,事業に携わる実業家。男女を問わない言い方を指す。,"She is a successful businessperson.",彼女は成功した実業家だ。
b1-part5-0194,latecomer,遅れて来た人,遅れて来た人・後発者。新参者を指す。,"The latecomer missed the first question.",遅刻した人は最初の問題を逃した。
b1-add1-0020,cashpoint,現金自動預け払い機、ATM,現金を引き出すATM。主に英で用いる語。,"I got some money from the cashpoint.",私はATMでお金をおろした。
b1-add1-0110,noticeboard,掲示板,知らせを貼る掲示板。主に英で用いる語(米ではbulletin board)。,"The schedule is on the noticeboard.",予定表は掲示板に貼ってある。
b1-part6-0023,washbowl,洗面器,手や顔を洗う洗面器。洗面ボウルを指す。,"Water filled the washbowl.",水が洗面器に満たされた。
