english,japanese,detail
probable,ありそうな,ありそうなを表す基本語。文脈で意味が広がる。
involvement,関連,関連を表す基本語。文脈で意味が広がる。
headquarters,本部,本部を表す基本語。文脈で意味が広がる。
consult,に頼る,に頼るを表す基本語。文脈で意味が広がる。
qualification,制限,制限を表す基本語。文脈で意味が広がる。
injection,注射,注射を表す基本語。文脈で意味が広がる。
clothing,衣類,衣類を表す基本語。文脈で意味が広がる。
reasonably,理性的に,理性的にを表す基本語。文脈で意味が広がる。
subdivision,区分,区分を表す基本語。文脈で意味が広がる。
known,名高い,名高いを表す基本語。文脈で意味が広がる。
replacement,置き換わること,置き換わることを表す基本語。文脈で意味が広がる。
ally,を同盟させる,を同盟させるを表す基本語。文脈で意味が広がる。
incentive,刺激,刺激を表す基本語。文脈で意味が広がる。
laser,レーザー,レーザーを表す基本語。文脈で意味が広がる。
ease,気楽さ,気楽さを表す基本語。文脈で意味が広がる。
investor,投資者,投資者を表す基本語。文脈で意味が広がる。
shipping,船積み,船積みを表す基本語。文脈で意味が広がる。
reinforce,を増強する,を増強するを表す基本語。文脈で意味が広がる。
erect,直立した,直立したを表す基本語。文脈で意味が広がる。
innovation,革新,革新を表す基本語。文脈で意味が広がる。
precisely,正確に,正確にを表す基本語。文脈で意味が広がる。
cabinet,キャビネット,キャビネットを表す基本語。文脈で意味が広がる。
relieve,を和らげる,を和らげるを表す基本語。文脈で意味が広がる。
excessive,度を越した,度を越したを表す基本語。文脈で意味が広がる。
regardless,むとんじゃくな,むとんじゃくなを表す基本語。文脈で意味が広がる。
thoroughly,徹底的に,徹底的にを表す基本語。文脈で意味が広がる。
disposition,気質,気質を表す基本語。文脈で意味が広がる。
stimulate,を刺激する,を刺激するを表す基本語。文脈で意味が広がる。
migration,移住,移住を表す基本語。文脈で意味が広がる。
sweep,を掃く,を掃くを表す基本語。文脈で意味が広がる。
revolutionary,革命の,革命のを表す基本語。文脈で意味が広がる。
arch,アーチ,アーチを表す基本語。文脈で意味が広がる。
memorial,記念の,記念のを表す基本語。文脈で意味が広がる。
fleet,艦隊,艦隊を表す基本語。文脈で意味が広がる。
divorce,離婚,離婚を表す基本語。文脈で意味が広がる。
editorial,社説,社説を表す基本語。文脈で意味が広がる。
alliance,同盟,同盟を表す基本語。文脈で意味が広がる。
deficit,不足額,不足額を表す基本語。文脈で意味が広がる。
mathematical,数学の,数学のを表す基本語。文脈で意味が広がる。
mature,成熟した,成熟したを表す基本語。文脈で意味が広がる。
projection,突き出ること,突き出ることを表す基本語。文脈で意味が広がる。
polish,を磨く,を磨くを表す基本語。文脈で意味が広がる。
noble,高貴の,高貴のを表す基本語。文脈で意味が広がる。
adverse,反対の,反対のを表す基本語。文脈で意味が広がる。
virtually,事実上,事実上を表す基本語。文脈で意味が広がる。
swing,を振る,を振るを表す基本語。文脈で意味が広がる。
inflation,インフレーション,インフレーションを表す基本語。文脈で意味が広がる。
exhaust,を疲れ果てさせる,を疲れ果てさせるを表す基本語。文脈で意味が広がる。
gaze,じっと見つめる,じっと見つめるを表す基本語。文脈で意味が広がる。
thesis,陳述,陳述を表す基本語。文脈で意味が広がる。
pose,姿勢をとる,姿勢をとるを表す基本語。文脈で意味が広がる。
embrace,を抱きしめる,を抱きしめるを表す基本語。文脈で意味が広がる。
peer,じっと見つめる,じっと見つめるを表す基本語。文脈で意味が広がる。
recreation,作り直し,作り直しを表す基本語。文脈で意味が広がる。
fabric,織物,織物を表す基本語。文脈で意味が広がる。
flame,炎のような輝き,炎のような輝きを表す基本語。文脈で意味が広がる。
likewise,同様に,同様にを表す基本語。文脈で意味が広がる。
friendly,好意的な,好意的なを表す基本語。文脈で意味が広がる。
worship,崇拝,崇拝を表す基本語。文脈で意味が広がる。
governmental,政治の,政治のを表す基本語。文脈で意味が広がる。
interfere,干渉する,干渉するを表す基本語。文脈で意味が広がる。
reprint,を再び印刷する,を再び印刷するを表す基本語。文脈で意味が広がる。
prompt,てきぱきした,てきぱきしたを表す基本語。文脈で意味が広がる。
stroke,一打ち,一打ちを表す基本語。文脈で意味が広がる。
serial,連載物,連載物を表す基本語。文脈で意味が広がる。
complexity,複雑さ,複雑さを表す基本語。文脈で意味が広がる。
assurance,保証,保証を表す基本語。文脈で意味が広がる。
dental,歯の,歯のを表す基本語。文脈で意味が広がる。
assemble,を集める,を集めるを表す基本語。文脈で意味が広がる。
hell,死者の国,死者の国を表す基本語。文脈で意味が広がる。
spray,小枝,小枝を表す基本語。文脈で意味が広がる。
approximate,近似の,近似のを表す基本語。文脈で意味が広がる。
sketch,スケッチ,スケッチを表す基本語。文脈で意味が広がる。
attendance,出席,出席を表す基本語。文脈で意味が広がる。
accumulate,を蓄積する,を蓄積するを表す基本語。文脈で意味が広がる。
separately,分かれて,分かれてを表す基本語。文脈で意味が広がる。
thread,糸,糸を表す基本語。文脈で意味が広がる。
fraud,詐欺,詐欺を表す基本語。文脈で意味が広がる。
instruct,に知識を与える,に知識を与えるを表す基本語。文脈で意味が広がる。
unto,に,にを表す基本語。文脈で意味が広がる。
blade,刃,刃を表す基本語。文脈で意味が広がる。
immigrant,移住者,移住者を表す基本語。文脈で意味が広がる。
evolve,を徐々に発展させる,を徐々に発展させるを表す基本語。文脈で意味が広がる。
alternate,交互の,交互のを表す基本語。文脈で意味が広がる。
solar,太陽の,太陽のを表す基本語。文脈で意味が広がる。
collector,収集家,収集家を表す基本語。文脈で意味が広がる。
widow,未亡人,未亡人を表す基本語。文脈で意味が広がる。
originate,を引き起こす,を引き起こすを表す基本語。文脈で意味が広がる。
controversy,論争,論争を表す基本語。文脈で意味が広がる。
consultant,専門的助言をする人,専門的助言をする人を表す基本語。文脈で意味が広がる。
fate,運命,運命を表す基本語。文脈で意味が広がる。
throat,のど,のどを表す基本語。文脈で意味が広がる。
versus,対,対を表す基本語。文脈で意味が広がる。
pitch,ピッチ,ピッチを表す基本語。文脈で意味が広がる。
tunnel,トンネル,トンネルを表す基本語。文脈で意味が広がる。
competent,有能な,有能なを表す基本語。文脈で意味が広がる。
walker,歩く人,歩く人を表す基本語。文脈で意味が広がる。
withdrawal,引っ込めること,引っ込めることを表す基本語。文脈で意味が広がる。
conceive,を心に抱く,を心に抱くを表す基本語。文脈で意味が広がる。
exclusively,排他的に,排他的にを表す基本語。文脈で意味が広がる。
inadequate,不十分な,不十分なを表す基本語。文脈で意味が広がる。
fixed,固定した,固定したを表す基本語。文脈で意味が広がる。
seller,売る人,売る人を表す基本語。文脈で意味が広がる。
flexible,曲げられる,曲げられるを表す基本語。文脈で意味が広がる。
confront,に立ち向かう,に立ち向かうを表す基本語。文脈で意味が広がる。
numerical,数の,数のを表す基本語。文脈で意味が広がる。
crucial,決定的な,決定的なを表す基本語。文脈で意味が広がる。
shield,盾,盾を表す基本語。文脈で意味が広がる。
suppress,を鎮圧する,を鎮圧するを表す基本語。文脈で意味が広がる。
undoubtedly,疑いなく,疑いなくを表す基本語。文脈で意味が広がる。
deck,デッキ,デッキを表す基本語。文脈で意味が広がる。
accommodation,便宜,便宜を表す基本語。文脈で意味が広がる。
strictly,厳格に,厳格にを表す基本語。文脈で意味が広がる。
resume,を再び始める,を再び始めるを表す基本語。文脈で意味が広がる。
rental,賃貸料,賃貸料を表す基本語。文脈で意味が広がる。
flesh,肉,肉を表す基本語。文脈で意味が広がる。
hay,干し草,干し草を表す基本語。文脈で意味が広がる。
vitamin,ビタミン,ビタミンを表す基本語。文脈で意味が広がる。
certification,証明,証明を表す基本語。文脈で意味が広がる。
voter,投票者,投票者を表す基本語。文脈で意味が広がる。
surrender,を引き渡す,を引き渡すを表す基本語。文脈で意味が広がる。
span,スパン,スパンを表す基本語。文脈で意味が広がる。
compile,をまとめる,をまとめるを表す基本語。文脈で意味が広がる。
striking,人目につく,人目につくを表す基本語。文脈で意味が広がる。
supplier,供給者,供給者を表す基本語。文脈で意味が広がる。
lighting,照明,照明を表す基本語。文脈で意味が広がる。
navigation,航行,航行を表す基本語。文脈で意味が広がる。
landing,上陸,上陸を表す基本語。文脈で意味が広がる。
ceiling,天井,天井を表す基本語。文脈で意味が広がる。
ritual,儀式の,儀式のを表す基本語。文脈で意味が広がる。
spare,を容赦する,を容赦するを表す基本語。文脈で意味が広がる。
genuine,本物の,本物のを表す基本語。文脈で意味が広がる。
artery,動脈,動脈を表す基本語。文脈で意味が広がる。
workman,仕事のな人,仕事のな人を表す基本語。文脈で意味が広がる。
assault,的な意で襲うこと,的な意で襲うことを表す基本語。文脈で意味が広がる。
hardware,金物類,金物類を表す基本語。文脈で意味が広がる。
probe,さぐり針,さぐり針を表す基本語。文脈で意味が広がる。
engagement,約束,約束を表す基本語。文脈で意味が広がる。
multiply,を増す,を増すを表す基本語。文脈で意味が広がる。
odd,奇妙な,奇妙なを表す基本語。文脈で意味が広がる。
certify,を証明する,を証明するを表す基本語。文脈で意味が広がる。
presumably,たぶん,たぶんを表す基本語。文脈で意味が広がる。
expedition,遠征,遠征を表す基本語。文脈で意味が広がる。
legitimate,合法的な,合法的なを表す基本語。文脈で意味が広がる。
suffering,苦痛,苦痛を表す基本語。文脈で意味が広がる。
merchandise,商品,商品を表す基本語。文脈で意味が広がる。
naval,海軍の,海軍のを表す基本語。文脈で意味が広がる。
bankruptcy,破産,破産を表す基本語。文脈で意味が広がる。
condemn,を非難する,を非難するを表す基本語。文脈で意味が広がる。
underground,地下の,地下のを表す基本語。文脈で意味が広がる。
grasp,をしっかり握る,をしっかり握るを表す基本語。文脈で意味が広がる。
hook,掛けくぎ,掛けくぎを表す基本語。文脈で意味が広がる。
trunk,幹,幹を表す基本語。文脈で意味が広がる。
informal,正式でない,正式でないを表す基本語。文脈で意味が広がる。
investigator,調査者,調査者を表す基本語。文脈で意味が広がる。
mask,仮面,仮面を表す基本語。文脈で意味が広がる。
feedback,フィードバック,フィードバックを表す基本語。文脈で意味が広がる。
outlet,出口,出口を表す基本語。文脈で意味が広がる。
potentially,可能性を秘めて,可能性を秘めてを表す基本語。文脈で意味が広がる。
stain,を汚す,を汚すを表す基本語。文脈で意味が広がる。
descend,下る,下るを表す基本語。文脈で意味が広がる。
forestry,林学,林学を表す基本語。文脈で意味が広がる。
flexibility,柔軟性,柔軟性を表す基本語。文脈で意味が広がる。
exploit,英雄的行為,英雄的行為を表す基本語。文脈で意味が広がる。
presidential,大統領の,大統領のを表す基本語。文脈で意味が広がる。
exclusion,除外すること,除外することを表す基本語。文脈で意味が広がる。
chip,木の切れ端,木の切れ端を表す基本語。文脈で意味が広がる。
patch,つぎ当て,つぎ当てを表す基本語。文脈で意味が広がる。
duplicate,そっくり同じの,そっくり同じのを表す基本語。文脈で意味が広がる。
impulse,衝動,衝動を表す基本語。文脈で意味が広がる。
limb,手足,手足を表す基本語。文脈で意味が広がる。
missile,ミサイル,ミサイルを表す基本語。文脈で意味が広がる。
conductor,指導者,指導者を表す基本語。文脈で意味が広がる。
beneficial,有益な,有益なを表す基本語。文脈で意味が広がる。
inspect,を検査する,を検査するを表す基本語。文脈で意味が広がる。
insufficient,不十分な,不十分なを表す基本語。文脈で意味が広がる。
lifetime,生涯,生涯を表す基本語。文脈で意味が広がる。
sail,帆,帆を表す基本語。文脈で意味が広がる。
skilled,熟練した,熟練したを表す基本語。文脈で意味が広がる。
wolf,オオカミ,オオカミを表す基本語。文脈で意味が広がる。
quotation,引用すること,引用することを表す基本語。文脈で意味が広がる。
heritage,世襲財産,世襲財産を表す基本語。文脈で意味が広がる。
bolt,ボルト,ボルトを表す基本語。文脈で意味が広がる。
conjunction,接続詞,接続詞を表す基本語。文脈で意味が広がる。
weed,雑草,雑草を表す基本語。文脈で意味が広がる。
shed,を流す,を流すを表す基本語。文脈で意味が広がる。
seldom,めったにない,めったにないを表す基本語。文脈で意味が広がる。
cope,対抗する,対抗するを表す基本語。文脈で意味が広がる。
gently,優しく,優しくを表す基本語。文脈で意味が広がる。
trait,特性,特性を表す基本語。文脈で意味が広がる。
compensate,に補償する,に補償するを表す基本語。文脈で意味が広がる。
vibration,震え,震えを表す基本語。文脈で意味が広がる。
pursuit,追うこと,追うことを表す基本語。文脈で意味が広がる。
ideology,イデオロギー,イデオロギーを表す基本語。文脈で意味が広がる。
respiratory,呼吸の,呼吸のを表す基本語。文脈で意味が広がる。
verbal,語の,語のを表す基本語。文脈で意味が広がる。
supervise,を監督する,を監督するを表す基本語。文脈で意味が広がる。
clarify,を明らかにする,を明らかにするを表す基本語。文脈で意味が広がる。
overlook,を見落とす,を見落とすを表す基本語。文脈で意味が広がる。
digest,を消化する,を消化するを表す基本語。文脈で意味が広がる。
