english,japanese,detail
feat,手柄,手柄を表す基本語。文脈で意味が広がる。
elemental,自然の力による,自然の力によるを表す基本語。文脈で意味が広がる。
burglary,住宅侵入,住宅侵入を表す基本語。文脈で意味が広がる。
tame,飼いならされた,飼いならされたを表す基本語。文脈で意味が広がる。
trophy,戦利品,戦利品を表す基本語。文脈で意味が広がる。
redundant,余計な,余計なを表す基本語。文脈で意味が広がる。
bewilder,を当惑させる,を当惑させるを表す基本語。文脈で意味が広がる。
overturn,をひっくり返す,をひっくり返すを表す基本語。文脈で意味が広がる。
salon,客間,客間を表す基本語。文脈で意味が広がる。
dependable,信頼できる,信頼できるを表す基本語。文脈で意味が広がる。
clap,ピシャリという音,ピシャリという音を表す基本語。文脈で意味が広がる。
ling,タラ科の食用魚,タラ科の食用魚を表す基本語。文脈で意味が広がる。
unsuitable,不適当な,不適当なを表す基本語。文脈で意味が広がる。
legendary,伝説の,伝説のを表す基本語。文脈で意味が広がる。
daytime,昼間,昼間を表す基本語。文脈で意味が広がる。
cocktail,カクテル,カクテルを表す基本語。文脈で意味が広がる。
traitor,裏切り者,裏切り者を表す基本語。文脈で意味が広がる。
humiliation,辱めること,辱めることを表す基本語。文脈で意味が広がる。
crease,折り目,折り目を表す基本語。文脈で意味が広がる。
chunk,厚切り,厚切りを表す基本語。文脈で意味が広がる。
retard,の進歩を遅らせる,の進歩を遅らせるを表す基本語。文脈で意味が広がる。
playwright,劇作家,劇作家を表す基本語。文脈で意味が広がる。
gloomy,暗い,暗いを表す基本語。文脈で意味が広がる。
cuff,そで口,そで口を表す基本語。文脈で意味が広がる。
commute,を振り替える,を振り替えるを表す基本語。文脈で意味が広がる。
proudly,威張って,威張ってを表す基本語。文脈で意味が広がる。
pickle,つけ汁,つけ汁を表す基本語。文脈で意味が広がる。
helper,助ける人,助ける人を表す基本語。文脈で意味が広がる。
fictional,作り事の,作り事のを表す基本語。文脈で意味が広がる。
paw,足,足を表す基本語。文脈で意味が広がる。
improbable,ありそうもない,ありそうもないを表す基本語。文脈で意味が広がる。
cardboard,厚紙,厚紙を表す基本語。文脈で意味が広がる。
nourish,を養う,を養うを表す基本語。文脈で意味が広がる。
erupt,噴出する,噴出するを表す基本語。文脈で意味が広がる。
relic,遺物,遺物を表す基本語。文脈で意味が広がる。
unnatural,不自然な,不自然なを表す基本語。文脈で意味が広がる。
immortality,不死,不死を表す基本語。文脈で意味が広がる。
sniff,かぐ,かぐを表す基本語。文脈で意味が広がる。
suitably,適当に,適当にを表す基本語。文脈で意味が広がる。
craftsman,職人,職人を表す基本語。文脈で意味が広がる。
cherry,サクランボ,サクランボを表す基本語。文脈で意味が広がる。
soybean,大豆,大豆を表す基本語。文脈で意味が広がる。
trio,三つ組,三つ組を表す基本語。文脈で意味が広がる。
entertaining,愉快な,愉快なを表す基本語。文脈で意味が広がる。
athletics,運動競技,運動競技を表す基本語。文脈で意味が広がる。
muddy,泥をかぶった,泥をかぶったを表す基本語。文脈で意味が広がる。
tyrant,暴君,暴君を表す基本語。文脈で意味が広がる。
pedal,ペダル,ペダルを表す基本語。文脈で意味が広がる。
bony,骨の,骨のを表す基本語。文脈で意味が広がる。
hairy,毛深い,毛深いを表す基本語。文脈で意味が広がる。
eloquent,雄弁な,雄弁なを表す基本語。文脈で意味が広がる。
sneak,こそこそ動く,こそこそ動くを表す基本語。文脈で意味が広がる。
demolish,を取り壊す,を取り壊すを表す基本語。文脈で意味が広がる。
adore,を深く愛する,を深く愛するを表す基本語。文脈で意味が広がる。
innate,生まれつきの,生まれつきのを表す基本語。文脈で意味が広がる。
boiling,沸騰,沸騰を表す基本語。文脈で意味が広がる。
unrealistic,非現実主義の,非現実主義のを表す基本語。文脈で意味が広がる。
ram,雄羊,雄羊を表す基本語。文脈で意味が広がる。
originality,独創性,独創性を表す基本語。文脈で意味が広がる。
paperwork,書類仕事,書類仕事を表す基本語。文脈で意味が広がる。
fascination,魅惑,魅惑を表す基本語。文脈で意味が広がる。
bizarre,一風変わった,一風変わったを表す基本語。文脈で意味が広がる。
statesman,政治家,政治家を表す基本語。文脈で意味が広がる。
consolation,慰め,慰めを表す基本語。文脈で意味が広がる。
catastrophic,悲劇的な,悲劇的なを表す基本語。文脈で意味が広がる。
coward,おくびょう者,おくびょう者を表す基本語。文脈で意味が広がる。
patiently,忍耐強く,忍耐強くを表す基本語。文脈で意味が広がる。
scientifically,科学的に,科学的にを表す基本語。文脈で意味が広がる。
obsession,つきまとうこと,つきまとうことを表す基本語。文脈で意味が広がる。
astonishment,驚き,驚きを表す基本語。文脈で意味が広がる。
unreliable,当てにならない,当てにならないを表す基本語。文脈で意味が広がる。
exaggeration,誇張,誇張を表す基本語。文脈で意味が広がる。
mover,動き人,動き人を表す基本語。文脈で意味が広がる。
refresh,を再び元気にする,を再び元気にするを表す基本語。文脈で意味が広がる。
casually,偶然に,偶然にを表す基本語。文脈で意味が広がる。
muse,深く考える,深く考えるを表す基本語。文脈で意味が広がる。
quarrel,口げんか,口げんかを表す基本語。文脈で意味が広がる。
lobby,ロビー,ロビーを表す基本語。文脈で意味が広がる。
incense,香,香を表す基本語。文脈で意味が広がる。
bellow,低く太い声で鳴く,低く太い声で鳴くを表す基本語。文脈で意味が広がる。
intrude,じゃまをする,じゃまをするを表す基本語。文脈で意味が広がる。
permeate,にしみ通る,にしみ通るを表す基本語。文脈で意味が広がる。
communicative,話好きな,話好きなを表す基本語。文脈で意味が広がる。
brewery,ビール醸造所,ビール醸造所を表す基本語。文脈で意味が広がる。
generously,気前よく,気前よくを表す基本語。文脈で意味が広がる。
orator,演説者,演説者を表す基本語。文脈で意味が広がる。
tramp,ドシンドシンと歩く,ドシンドシンと歩くを表す基本語。文脈で意味が広がる。
usher,案内人,案内人を表す基本語。文脈で意味が広がる。
preoccupy,をいっぱいにする,をいっぱいにするを表す基本語。文脈で意味が広がる。
icy,氷の,氷のを表す基本語。文脈で意味が広がる。
rattle,ガタガタ音を立てる,ガタガタ音を立てるを表す基本語。文脈で意味が広がる。
rhyme,韻,韻を表す基本語。文脈で意味が広がる。
dictator,独裁者,独裁者を表す基本語。文脈で意味が広がる。
ethic,倫理,倫理を表す基本語。文脈で意味が広がる。
obedient,従順な,従順なを表す基本語。文脈で意味が広がる。
wed,と結婚する,と結婚するを表す基本語。文脈で意味が広がる。
skim,から上澄みを取る,から上澄みを取るを表す基本語。文脈で意味が広がる。
deceptive,人をだますような,人をだますようなを表す基本語。文脈で意味が広がる。
sandstone,砂岩,砂岩を表す基本語。文脈で意味が広がる。
immoral,不道徳な,不道徳なを表す基本語。文脈で意味が広がる。
broadcaster,放送者,放送者を表す基本語。文脈で意味が広がる。
clam,ハマグリ,ハマグリを表す基本語。文脈で意味が広がる。
ravage,破壊,破壊を表す基本語。文脈で意味が広がる。
confidently,自信をもって,自信をもってを表す基本語。文脈で意味が広がる。
wit,知る,知るを表す基本語。文脈で意味が広がる。
orchid,ラン,ランを表す基本語。文脈で意味が広がる。
squash,を押しつぶす,を押しつぶすを表す基本語。文脈で意味が広がる。
flax,亜麻,亜麻を表す基本語。文脈で意味が広がる。
relativity,関係のあること,関係のあることを表す基本語。文脈で意味が広がる。
doubly,倍に,倍にを表す基本語。文脈で意味が広がる。
bomber,爆撃機,爆撃機を表す基本語。文脈で意味が広がる。
complexion,顔のつや・顔色,顔のつや・顔色を表す基本語。文脈で意味が広がる。
irresistible,抵抗できない,抵抗できないを表す基本語。文脈で意味が広がる。
delicacy,優美さ,優美さを表す基本語。文脈で意味が広がる。
oath,誓い,誓いを表す基本語。文脈で意味が広がる。
diphtheria,ジフテリア,ジフテリアを表す基本語。文脈で意味が広がる。
mumble,をもぐもぐ言う,をもぐもぐ言うを表す基本語。文脈で意味が広がる。
coma,こん睡状態,こん睡状態を表す基本語。文脈で意味が広がる。
affectionate,愛情のこもった,愛情のこもったを表す基本語。文脈で意味が広がる。
messenger,使いの者,使いの者を表す基本語。文脈で意味が広がる。
rusty,さびた,さびたを表す基本語。文脈で意味が広がる。
wink,目くばせする,目くばせするを表す基本語。文脈で意味が広がる。
beak,くちばし,くちばしを表す基本語。文脈で意味が広がる。
glorify,をほめたたえる,をほめたたえるを表す基本語。文脈で意味が広がる。
recollect,を思い出す,を思い出すを表す基本語。文脈で意味が広がる。
emphatically,断固として,断固としてを表す基本語。文脈で意味が広がる。
unwise,分別のない,分別のないを表す基本語。文脈で意味が広がる。
unofficial,非公式の,非公式のを表す基本語。文脈で意味が広がる。
roam,あてもなく歩き回る,あてもなく歩き回るを表す基本語。文脈で意味が広がる。
foreman,職長,職長を表す基本語。文脈で意味が広がる。
devil,悪魔,悪魔を表す基本語。文脈で意味が広がる。
repress,を抑圧する,を抑圧するを表す基本語。文脈で意味が広がる。
stockpile,備蓄,備蓄を表す基本語。文脈で意味が広がる。
stimulant,刺激,刺激を表す基本語。文脈で意味が広がる。
legislate,法律を制定する,法律を制定するを表す基本語。文脈で意味が広がる。
ambassador,大使,大使を表す基本語。文脈で意味が広がる。
inflate,をふくらます,をふくらますを表す基本語。文脈で意味が広がる。
momentarily,ちょっとの間,ちょっとの間を表す基本語。文脈で意味が広がる。
winding,うねる,うねるを表す基本語。文脈で意味が広がる。
inseparable,分けられない,分けられないを表す基本語。文脈で意味が広がる。
momentary,瞬時の,瞬時のを表す基本語。文脈で意味が広がる。
attentive,注意深い,注意深いを表す基本語。文脈で意味が広がる。
inexperienced,経験のない,経験のないを表す基本語。文脈で意味が広がる。
bully,弱い者いじめ,弱い者いじめを表す基本語。文脈で意味が広がる。
amazement,たいへんな驚き,たいへんな驚きを表す基本語。文脈で意味が広がる。
wrongly,間違って,間違ってを表す基本語。文脈で意味が広がる。
setback,妨げ,妨げを表す基本語。文脈で意味が広がる。
plumber,鉛管工,鉛管工を表す基本語。文脈で意味が広がる。
warship,軍艦,軍艦を表す基本語。文脈で意味が広がる。
freak,気まぐれ,気まぐれを表す基本語。文脈で意味が広がる。
eloquence,雄弁,雄弁を表す基本語。文脈で意味が広がる。
rejoin,に再び加わる,に再び加わるを表す基本語。文脈で意味が広がる。
atypical,型にはまらない,型にはまらないを表す基本語。文脈で意味が広がる。
impractical,実用的でない,実用的でないを表す基本語。文脈で意味が広がる。
eyelid,まぶた,まぶたを表す基本語。文脈で意味が広がる。
dawn,夜明け,夜明けを表す基本語。文脈で意味が広がる。
misconception,誤解,誤解を表す基本語。文脈で意味が広がる。
carnival,謝肉祭,謝肉祭を表す基本語。文脈で意味が広がる。
replica,原作の写し,原作の写しを表す基本語。文脈で意味が広がる。
unmistakable,まぎれもない,まぎれもないを表す基本語。文脈で意味が広がる。
nostril,鼻孔,鼻孔を表す基本語。文脈で意味が広がる。
everlasting,永久に続く,永久に続くを表す基本語。文脈で意味が広がる。
luxurious,ぜいたくな,ぜいたくなを表す基本語。文脈で意味が広がる。
irresponsible,無責任な,無責任なを表す基本語。文脈で意味が広がる。
fabulous,伝説上の,伝説上のを表す基本語。文脈で意味が広がる。
pudding,プディング,プディングを表す基本語。文脈で意味が広がる。
prestigious,誉れの高い,誉れの高いを表す基本語。文脈で意味が広がる。
underwear,下着,下着を表す基本語。文脈で意味が広がる。
arrogant,傲慢な,傲慢なを表す基本語。文脈で意味が広がる。
housekeeper,主婦,主婦を表す基本語。文脈で意味が広がる。
lighten,を明るくする,を明るくするを表す基本語。文脈で意味が広がる。
browse,漫然とながめる,漫然とながめるを表す基本語。文脈で意味が広がる。
enthusiastically,熱狂的に,熱狂的にを表す基本語。文脈で意味が広がる。
elegance,優美,優美を表す基本語。文脈で意味が広がる。
hush,静けさ,静けさを表す基本語。文脈で意味が広がる。
bumper,バンパー,バンパーを表す基本語。文脈で意味が広がる。
childish,子供の,子供のを表す基本語。文脈で意味が広がる。
salesperson,販売員,販売員を表す基本語。文脈で意味が広がる。
devoted,献身的な,献身的なを表す基本語。文脈で意味が広がる。
ointment,軟こう,軟こうを表す基本語。文脈で意味が広がる。
peep,のぞき見する,のぞき見するを表す基本語。文脈で意味が広がる。
clumsy,無器用な,無器用なを表す基本語。文脈で意味が広がる。
nervously,神経質に,神経質にを表す基本語。文脈で意味が広がる。
ballad,民謡,民謡を表す基本語。文脈で意味が広がる。
broadband,広帯域の,広帯域のを表す基本語。文脈で意味が広がる。
mimic,をまねてからかう,をまねてからかうを表す基本語。文脈で意味が広がる。
overhear,をふと耳にする,をふと耳にするを表す基本語。文脈で意味が広がる。
unpopular,人気のない,人気のないを表す基本語。文脈で意味が広がる。
creek,小川,小川を表す基本語。文脈で意味が広がる。
desperation,絶望状態,絶望状態を表す基本語。文脈で意味が広がる。
adaptable,適応できる,適応できるを表す基本語。文脈で意味が広がる。
vomit,吐く,吐くを表す基本語。文脈で意味が広がる。
witty,機知に富んだ,機知に富んだを表す基本語。文脈で意味が広がる。
pedestrian,歩行者,歩行者を表す基本語。文脈で意味が広がる。
rosy,バラ色の,バラ色のを表す基本語。文脈で意味が広がる。
exalt,を昇進させる,を昇進させるを表す基本語。文脈で意味が広がる。
wasp,スズメバチ,スズメバチを表す基本語。文脈で意味が広がる。
outskirts,はずれ,はずれを表す基本語。文脈で意味が広がる。
intruder,侵入者,侵入者を表す基本語。文脈で意味が広がる。
obsess,にとりつく,にとりつくを表す基本語。文脈で意味が広がる。
