id,english,japanese,detail,sample,sample-jpn
c1-part1-0104,degradation,低下；劣化,「低下」という状態や考えを表す語。学術・法律・制度などの改まった文脈で多い。「劣化」の意味もある。 ,"Pollution caused environmental degradation.",汚染が環境の悪化を引き起こした。
c1-part1-0105,exploitation,搾取；活用,「搾取」という状態や考えを表す語。学術・法律・制度などの改まった文脈で多い。「活用」の意味もある。 ,"The company was accused of exploitation.",その会社は搾取で告発された。
c1-part1-0106,pertinent,関連する；適切な,話題や状況に直接関係している・適切なイメージ。関連するという形容詞。,"His question was pertinent to the topic.",彼の質問はトピックに関連していた。
c1-part1-0107,hostility,敵意,「敵意」という状態や考えを表す語。学術・法律・制度などの改まった文脈で多い。 ,"Hostility between the groups increased.",グループ間の敵意が高まった。
c1-part1-0108,predecessor,前任者,「前任者」を表す語という具体的対象。人・物・場所などを直接指す語。 ,"My predecessor trained me for the job.",私の前任者が仕事を教えてくれた。
c1-part1-0109,aesthetic,美的な；美学の,「美的な」という性質を表す語。人・物・状況を評価・分類する形容詞表現。「美学の」の意味もある。 ,"The design has aesthetic value.",そのデザインには美的価値がある。
c1-part1-0110,spontaneous,自然に起こる,「自然に起こる」を表す語。具体的な意味から、比喩・専門的な使い方にも広がる。 ,"His spontaneous speech surprised us.",彼の即興スピーチが私たちを驚かせた。
c1-part1-0111,customary,慣例の；習慣的な,「慣例の」という性質を表す語。人・物・状況を評価・分類する形容詞表現。「習慣的な」の意味もある。 ,"It is customary to bow in that situation.",その状況でお辞儀をするのが習慣だ。
c1-part1-0112,immense,巨大な,「巨大な」という性質を表す語。人・物・状況を評価・分類する形容詞表現。 ,"The mountain looked immense.",山は巨大に見えた。
c1-part1-0113,peninsula,半島,「半島」を表す語という具体的対象。人・物・場所などを直接指す語。 ,"Italy is a peninsula in southern Europe.",イタリアは南ヨーロッパの半島だ。
c1-part1-0114,simplicity,簡単,「簡単」という状態や考えを表す語。学術・法律・制度などの改まった文脈で多い。 ,"The simplicity of the design impressed us.",デザインのシンプルさが私たちを感動させた。
c1-part1-0115,trauma,外傷,「外傷」を表す語。具体的な意味から、比喩・専門的な使い方にも広がる。 ,"The accident caused lasting trauma.",その事故は長期的なトラウマを引き起こした。
c1-part1-0116,legacy,遺産,「遺産」という状態や考えを表す語。学術・法律・制度などの改まった文脈で多い。 ,"Her legacy continues through her books.",彼女の遺産は著書を通じて受け継がれている。
c1-part1-0117,maternal,母の；母性的な,「母の」という性質を表す語。人・物・状況を評価・分類する形容詞表現。「母性的な」の意味もある。 ,"She felt a strong maternal instinct.",彼女は強い母性本能を感じた。
c1-part1-0118,purity,純粋であること,「純粋であること」という状態や考えを表す語。学術・法律・制度などの改まった文脈で多い。 ,"The lab tested the water’s purity.",研究室が水の純度を試験した。
c1-part1-0119,orchard,果樹園,「果樹園」を表す語という具体的対象。人・物・場所などを直接指す語。 ,"Apples grow in the orchard.",リンゴが果樹園で育つ。
c1-part1-0120,fixture,備品；固定設備,固定して取り付けられた設備・備品。定期試合や常連という意味にも使う。,"The lamp is a permanent fixture in the room.",ランプは部屋に常設されている。
c1-part1-0121,descent,下降；血統,「下降」を表す語。具体的な意味から、比喩・専門的な使い方にも広がる。「血統」の意味もある。 ,"The plane began its descent.",飛行機は降下を始めた。
c1-part1-0122,speculation,推測,「推測」という状態や考えを表す語。学術・法律・制度などの改まった文脈で多い。 ,"There was speculation about the merger.",合併についての憶測があった。
c1-part1-0123,ventilation,換気,「換気」という状態や考えを表す語。学術・法律・制度などの改まった文脈で多い。 ,"Good ventilation keeps the room fresh.",良好な換気が部屋を新鮮に保つ。
c1-part1-0124,anthropology,人類学,「人類学」という状態や考えを表す語。学術・法律・制度などの改まった文脈で多い。 ,"She studied anthropology at university.",彼女は大学で人類学を学んだ。
c1-part1-0125,apt,～ しがちな；適切な,「しがちな」という性質を表す語。人・物・状況を評価・分類する形容詞表現。「適切な」の意味もある。 ,"His comment was apt and timely.",彼のコメントは適切でタイムリーだった。
c1-part1-0126,clutch,～ をぐいとつかむ,「ぐいとつかむ」という動き・変化を表す語。物理的な動作だけでなく、抽象的な作用にも使う。 ,"She tried to clutch the bag tightly.",彼女はバッグをしっかり握ろうとした。
c1-part1-0127,conditional,条件つきの,「条件つきの」という性質を表す語。人・物・状況を評価・分類する形容詞表現。 ,"His offer was conditional on approval.",彼の申し出は承認を条件としていた。
c1-part1-0128,portable,持ち運びのできる,「持ち運びのできる」という性質を表す語。人・物・状況を評価・分類する形容詞表現。 ,"This portable charger fits in a pocket.",このポータブル充電器はポケットに入る。
c1-part1-0129,flourish,栄える,「栄える」という動き・変化を表す語。物理的な動作だけでなく、抽象的な作用にも使う。 ,"Small businesses flourish in this town.",小規模ビジネスがこの町で繁栄している。
c1-part1-0130,manipulation,巧妙な扱い,「巧妙な扱い」という状態や考えを表す語。学術・法律・制度などの改まった文脈で多い。 ,"The magician used manipulation to fool the audience.",マジシャンは観客を惑わすためにトリックを使った。
c1-part1-0131,discard,～ を捨てる,「捨てる」という動き・変化を表す語。物理的な動作だけでなく、抽象的な作用にも使う。 ,"Please discard the broken parts.",壊れた部品を捨ててください。
c1-part1-0132,portray,～ を絵で描く,「絵で描く」という動き・変化を表す語。物理的な動作だけでなく、抽象的な作用にも使う。 ,"The painting can portray deep sadness.",その絵は深い悲しみを描くことができる。
c1-part1-0133,quest,探求,「探求」を表す語。具体的な意味から、比喩・専門的な使い方にも広がる。 ,"The knight began a dangerous quest.",騎士が危険な探索を始めた。
c1-part1-0134,seedling,実生の若木,「実生の若木」を表す語。具体的な意味から、比喩・専門的な使い方にも広がる。 ,"The farmer planted a young seedling.",農家が若い苗を植えた。
c1-part1-0135,recess,休み,「休み」を表す語。具体的な意味から、比喩・専門的な使い方にも広がる。 ,"The children played outside during recess.",子どもたちは休み時間に外で遊んだ。
c1-part1-0136,appliance,器具,「器具」という状態や考えを表す語。学術・法律・制度などの改まった文脈で多い。 ,"The kitchen appliance stopped working.",台所の電化製品が動かなくなった。
c1-part1-0137,exterior,外の,「外の」という性質を表す語。人・物・状況を評価・分類する形容詞表現。 ,"The exterior of the house is white.",家の外観は白だ。
c1-part1-0138,conformity,～ との相似,「相似」という動き・変化を表す語。物理的な動作だけでなく、抽象的な作用にも使う。 ,"Conformity can limit new ideas.",同調は新しいアイデアを制限することがある。
c1-part1-0139,provoke,～ を怒らせる,「怒らせる」という動き・変化を表す語。物理的な動作だけでなく、抽象的な作用にも使う。 ,"Do not provoke the dog.",犬を怒らせてはいけない。
c1-part1-0140,adjoin,～ に隣接する,「隣接する」という動き・変化を表す語。物理的な動作だけでなく、抽象的な作用にも使う。 ,"The new room will adjoin the kitchen.",新しい部屋はキッチンに隣接する予定だ。
c1-part1-0141,uniformity,一定,「一定」という状態や考えを表す語。学術・法律・制度などの改まった文脈で多い。 ,"Uniformity in size made the boxes easy to stack.",サイズの統一性が箱を積みやすくした。
c1-part1-0142,injustice,不正,「不正」を表す語。具体的な意味から、比喩・専門的な使い方にも広がる。 ,"The law aimed to correct injustice.",その法律は不正義を是正することを目的としていた。
c1-part1-0143,graft,接ぎ木；移植；汚職,植物の接ぎ木・皮膚移植。転じて贈収賄・汚職の意味にも使われる語。,"Doctors may graft skin onto the wound.",医師は傷口に皮膚を移植することがある。
c1-part1-0144,antiquity,古代；古物,「古代」という状態や考えを表す語。学術・法律・制度などの改まった文脈で多い。「古物」の意味もある。 ,"The vase dates from antiquity.",その花瓶は古代から残るものだ。
c1-part1-0145,evoke,～ を呼び出す,「呼び出す」という動き・変化を表す語。物理的な動作だけでなく、抽象的な作用にも使う。 ,"The photo can evoke memories of childhood.",その写真は幼少時代の思い出を呼び起こすことができる。
c1-part1-0146,superficial,表面の,「表面の」という性質を表す語。人・物・状況を評価・分類する形容詞表現。 ,"The cut was superficial.",その傷は表面的なものだった。
c1-part1-0147,amateur,アマチュア；素人,「アマチュア」を表す語という具体的対象。人・物・場所などを直接指す語。「素人」の意味もある。 ,"An amateur photographer took the picture.",アマチュアのカメラマンが写真を撮った。
c1-part1-0148,mutually,相互に,「相互に」を表す語という仕方。動作・判断の程度や話し手の態度を補う。 ,"The agreement was mutually beneficial.",その合意は双方にとって有益だった。
c1-part1-0149,demographic,人口統計学の,「人口統計学の」という性質を表す語。人・物・状況を評価・分類する形容詞表現。 ,"The survey collected demographic information.",調査は人口統計情報を収集した。
c1-part1-0150,suffice,十分である,「十分である」という動き・変化を表す語。物理的な動作だけでなく、抽象的な作用にも使う。 ,"A simple apology will suffice for this mistake.",この間違いには簡単な謝罪で十分だ。
c1-part1-0151,negligible,取るに足らない,「取るに足らない」という性質を表す語。人・物・状況を評価・分類する形容詞表現。 ,"The difference in price was negligible.",価格の差はわずかだった。
c1-part1-0152,tailor,洋服屋,「洋服屋」を表す語。具体的な意味から、比喩・専門的な使い方にも広がる。 ,"The tailor repaired my jacket.",仕立て屋が私のジャケットを修理した。
c1-part1-0153,acoustic,音響の,「音響の」という性質を表す語。人・物・状況を評価・分類する形容詞表現。 ,"The acoustic guitar sounded warm.",アコースティックギターは温かみのある音がした。
c1-part1-0154,lapse,一時的な誤り；経過,「一時的な誤り」を表す語。具体的な意味から、比喩・専門的な使い方にも広がる。「経過」の意味もある。 ,"A momentary lapse caused the accident.",一瞬の不注意が事故を引き起こした。
c1-part1-0155,fuse,ヒューズ；融合する,電気回路の安全装置のヒューズ。溶け合う・融合するという動詞にも使う。,"Replace the fuse before turning on the power.",電源を入れる前にヒューズを交換しなさい。
c1-part1-0156,muscular,筋肉の,「筋肉の」という性質を表す語。人・物・状況を評価・分類する形容詞表現。 ,"The athlete has muscular arms.",その選手は筋肉質な腕を持っている。
c1-part1-0157,terrain,地形,「地形」を表す語。具体的な意味から、比喩・専門的な使い方にも広がる。 ,"The rough terrain slowed the rescue team.",険しい地形が救助チームの速度を落とした。
c1-part1-0158,preacher,伝道師,「伝道師」を表す語という具体的対象。人・物・場所などを直接指す語。 ,"The preacher spoke to the crowd in the church.",説教師が教会で群衆に語りかけた。
c1-part1-0159,plunge,～ を突っ込む；急落する,水や穴へ勢いよく飛び込む。株価などが急落する意味にも使う重要語。,"The diver will plunge into the cold water.",ダイバーは冷たい水に飛び込む予定だ。
c1-part1-0160,voluntarily,みずから進んで,「みずから進んで」を表す語という仕方。動作・判断の程度や話し手の態度を補う。 ,"She voluntarily helped clean the park.",彼女は自発的に公園の清掃を手伝った。
c1-part1-0161,plaster,しっくい；ばんそうこう,壁に塗るしっくい・漆喰。医療用のばんそうこうの意味でも使われる語。,"The doctor put a plaster cast on his broken arm.",医者は折れた腕に石膏ギプスをはめた。
c1-part1-0162,conserve,～ を保存する,「保存する」という動き・変化を表す語。物理的な動作だけでなく、抽象的な作用にも使う。 ,"We must conserve water during the drought.",干ばつの間は水を節約しなければならない。
c1-part1-0163,charter,憲章；特許状；貸し切る,団体の設立文書・憲章。特許状・勅許状、乗り物を貸し切る意味もある。,"The school operates under a special charter.",学校は特別な認可の下で運営されている。
c1-part1-0164,durable,耐久力のある,「耐久力のある」という性質を表す語。人・物・状況を評価・分類する形容詞表現。 ,"The durable bag lasted for years.",丈夫なバッグは何年も持ちこたえた。
c1-part1-0165,privileged,特権のある,「特権のある」という性質を表す語。人・物・状況を評価・分類する形容詞表現。 ,"Only privileged guests entered the room.",特権を持つゲストだけが部屋に入れた。
c1-part1-0166,posture,姿勢,「姿勢」という状態や考えを表す語。学術・法律・制度などの改まった文脈で多い。 ,"Good posture helps prevent back pain.",良い姿勢は腰痛予防に役立つ。
c1-part1-0167,suburban,郊外の,「郊外の」という性質を表す語。人・物・状況を評価・分類する形容詞表現。 ,"They moved to a suburban neighborhood.",彼らは郊外の住宅地に引っ越した。
c1-part1-0168,facial,顔の,「顔の」という性質を表す語。人・物・状況を評価・分類する形容詞表現。 ,"Facial expressions show emotion.",表情は感情を示す。
c1-part1-0169,complementary,補足的な,「補足的な」という性質を表す語。人・物・状況を評価・分類する形容詞表現。 ,"These two colors are complementary.",この二色は補色だ。
c1-part1-0170,loom,迫る；織機,「迫る」を表す語という具体的対象。人・物・場所などを直接指す語。「織機」の意味もある。 ,"Dark clouds began to loom over the town.",暗い雲が街の上にのしかかり始めた。
c1-part1-0171,robust,たくましい,「たくましい」を表す語。具体的な意味から、比喩・専門的な使い方にも広がる。 ,"The table has a robust frame.",テーブルはしっかりした骨組みを持っている。
c1-part1-0172,elongate,～ を長くする,「長くする」という動き・変化を表す語。物理的な動作だけでなく、抽象的な作用にも使う。 ,"Stretching can elongate the muscle fibers.",ストレッチで筋繊維を伸ばすことができる。
c1-part1-0173,outset,最初；発端,「最初」を表す語。具体的な意味から、比喩・専門的な使い方にも広がる。「発端」の意味もある。 ,"The rules were clear from the outset.",ルールは最初から明確だった。
c1-part1-0174,wicked,邪悪な；ひどい,「邪悪な」を表す語。具体的な意味から、比喩・専門的な使い方にも広がる。「ひどい」の意味もある。 ,"The villain had a wicked smile.",悪役は邪悪な笑みを浮かべた。
c1-part1-0175,intellect,知性,「知性」という状態や考えを表す語。学術・法律・制度などの改まった文脈で多い。 ,"The book challenged his intellect.",その本は彼の知性を試した。
c1-part1-0176,credibility,信用できること,「信用できること」という状態や考えを表す語。学術・法律・制度などの改まった文脈で多い。 ,"The scandal damaged his credibility.",スキャンダルが彼の信頼性を損なった。
c1-part1-0177,prop,支柱；支えるもの,「支柱」という性質を表す語。人・物・状況を評価・分類する形容詞表現。「支えるもの」の意味もある。 ,"Use a stick to prop the door open.",棒を使ってドアを支えなさい。
c1-part1-0178,commend,～ をほめる,「ほめる」という動き・変化を表す語。物理的な動作だけでなく、抽象的な作用にも使う。 ,"The manager will commend her for hard work.",マネージャーは彼女の努力を称えるだろう。
c1-part1-0179,commercially,商業上,「商業上」を表す語という仕方。動作・判断の程度や話し手の態度を補う。 ,"The product is sold commercially.",その製品は商業的に販売されている。
c1-part1-0180,realism,現実主義,「現実主義」という状態や考えを表す語。学術・法律・制度などの改まった文脈で多い。 ,"Realism shows life without idealizing it.",リアリズムは現実を理想化せずに示す。
c1-part1-0181,dispense,～ を分配する；不要にする,薬や物を分配・調合して配る。dispense with で「なしで済む」意味も。,"The machine can dispense tickets automatically.",機械は自動的に切符を発行できる。
c1-part1-0182,explanatory,解説の,「解説の」という性質を表す語。人・物・状況を評価・分類する形容詞表現。 ,"The teacher gave an explanatory note.",先生は説明のメモを渡した。
c1-part1-0183,domination,支配,「支配」という状態や考えを表す語。学術・法律・制度などの改まった文脈で多い。 ,"The empire sought domination over its neighbors.",帝国は隣国への支配を求めた。
c1-part1-0184,embark,乗り出す；乗船する,船・飛行機に乗り込む。embark on で新たな事業などに乗り出す意味も。,"We will embark on a new project.",私たちは新しいプロジェクトに乗り出す予定だ。
c1-part1-0185,faction,派閥,「派閥」という状態や考えを表す語。学術・法律・制度などの改まった文脈で多い。 ,"A rival faction opposed the plan.",対立する派閥がその計画に反対した。
c1-part1-0186,strap,ひも,「ひも」を表す語。具体的な意味から、比喩・専門的な使い方にも広がる。 ,"Tighten the strap on your backpack.",バックパックのストラップを締めなさい。
c1-part1-0187,latent,潜在している,「潜在している」を表す語。具体的な意味から、比喩・専門的な使い方にも広がる。 ,"The disease can remain latent for years.",その病気は何年も潜伏したままでいることがある。
c1-part1-0188,scrutiny,綿密な調査,「綿密な調査」を表す語。具体的な意味から、比喩・専門的な使い方にも広がる。 ,"The plan came under close scrutiny.",その計画は厳しい精査を受けた。
c1-part1-0189,chill,寒気,「寒気」を表す語。具体的な意味から、比喩・専門的な使い方にも広がる。 ,"A chill ran down my back.",背筋がぞっとした。
c1-part1-0190,amid,～ の中で,「中で」を表す語。具体的な意味から、比喩・専門的な使い方にも広がる。 ,"She stayed calm amid the noise.",彼女は騒音の中でも冷静を保った。
c1-part1-0191,degrade,～ の地位を下げる,「地位を下げる」を表す語。具体的な意味から、比喩・専門的な使い方にも広がる。 ,"Pollution can degrade the environment.",汚染が環境を悪化させることがある。
c1-part1-0192,isolated,孤立した,「孤立した」という性質を表す語。人・物・状況を評価・分類する形容詞表現。 ,"The isolated village had no internet.",孤立した村にはインターネットがなかった。
c1-part1-0193,flask,フラスコ；小型びん,「フラスコ」を表す語という具体的対象。人・物・場所などを直接指す語。「小型びん」の意味もある。 ,"The scientist poured water into a flask.",科学者はフラスコに水を注いだ。
c1-part1-0194,bulk,大部分；大量,「大部分」を表す語。具体的な意味から、比喩・専門的な使い方にも広がる。「大量」の意味もある。 ,"They bought rice in bulk.",彼らは米をまとめ買いした。
c1-part1-0195,abstraction,抽象,「抽象」という状態や考えを表す語。学術・法律・制度などの改まった文脈で多い。 ,"The painting moves toward abstraction.",その絵は抽象の方向へ向かっている。
c1-part1-0196,endorsement,支持；裏書き,公的に支持・推薦すること。裏書き・スポンサー支援の意味もある語。,"The candidate received a major endorsement.",候補者は主要な支持を受けた。
c1-part1-0197,indefinite,不明確な,「不明確な」という性質を表す語。人・物・状況を評価・分類する形容詞表現。 ,"The meeting was postponed for an indefinite period.",会議は無期限に延期された。
c1-part1-0198,confinement,閉じ込め；制限,狭い場所に閉じ込められた状態。禁固・出産後の産後の意味にも使う。,"The prisoner lived in solitary confinement.",囚人は独房に住んでいた。
c1-part1-0199,advantageous,有利な,「有利な」という性質を表す語。人・物・状況を評価・分類する形容詞表現。 ,"The agreement was advantageous to both sides.",その合意は双方にとって有利だった。
c1-part1-0200,speculative,推測の；投機的な,「推測の」という性質を表す語。人・物・状況を評価・分類する形容詞表現。「投機的な」の意味もある。 ,"The article made a speculative claim.",その記事は憶測に基づく主張をした。
