id,english,japanese,detail,sample,sample-jpn
a1-part4-0143,pen,ペン,身近な物を表す「ペン」。形・用途・持ち物の説明で使う。 ,"The pen rolled under the desk.",a1-part4-0143_例文の日本語訳
a1-part4-0144,everywhere,あらゆる所に,「あらゆる所に」を表す語。物事・考え・状態を表す基本名詞。 ,"Wildflowers grew everywhere after the rain.",a1-part4-0144_例文の日本語訳
a1-part4-0145,butter,バター,食べ物・飲み物の「バター」。食事や好みの話で使う。 ,"Butter melted on the toast.",a1-part4-0145_例文の日本語訳
a1-part4-0146,celebrate,～を祝う,「～を祝う」という動き・変化を表す語。人・物への働きかけを表す。 ,"They celebrate the festival every summer.",a1-part4-0146_例文の日本語訳
a1-part4-0147,excuse,～を許す；言い訳,許しや理由を求める語。「Excuse me.」で呼びかけにも使う。意味は「許す」・「言い訳」などに分かれる。 ,"Excuse me, is this seat taken?",a1-part4-0147_例文の日本語訳
a1-part4-0148,dig,～を掘る,「～を掘る」という動き・変化を表す語。人・物への働きかけを表す。 ,"Dig a small hole for the seed.",a1-part4-0148_例文の日本語訳
a1-part4-0149,smell,～のにおいがする；におい,鼻で感じるもの。におい・におう・かぐの意味。「のにおいがする」の意味もある。 ,"The smell of bread filled the kitchen.",a1-part4-0149_例文の日本語訳
a1-part4-0150,everybody,みんな、すべての人,「みんな、すべての人」を表す語。物事・考え・状態を表す基本名詞。 ,"Everybody arrived early.",a1-part4-0150_例文の日本語訳
a1-part4-0151,blank,空白の；空欄,「空白の；空欄」を表す語。物事・考え・状態を表す基本名詞。 ,"Leave this line blank.",a1-part4-0151_例文の日本語訳
a1-part4-0152,stone,石,身近な物を表す「石」。形・用途・持ち物の説明で使う。 ,"A flat stone skipped across the pond.",a1-part4-0152_例文の日本語訳
a1-part4-0153,lunch,昼食,時を表す「昼食」。予定・順序・期間を説明する時に使う。 ,"Let's have lunch together.",a1-part4-0153_例文の日本語訳
a1-part4-0154,dear,親愛な,「親愛な」という性質を表す語。人・物・状況の様子を表す。 ,"Dear friends gathered around the table.",a1-part4-0154_例文の日本語訳
a1-part4-0155,dad,おとうちゃん,人・役割を表す「おとうちゃん」。家族・職業・立場を示す語。 ,"The manager reviewed the dad before the meeting.",a1-part4-0155_例文の日本語訳
a1-part4-0156,reporter,報告者,人・役割を表す「報告者」。家族・職業・立場を示す語。 ,"The invoice listed the reporter clearly.",a1-part4-0156_例文の日本語訳
a1-part4-0157,fun,楽しみ,楽しいこと・楽しさ。形容詞的にも使う口語的な語。 ,"The game was fun for everyone.",a1-part4-0157_例文の日本語訳
a1-part4-0158,strict,厳しい,規則や基準に厳しい状態。人・制度に使う。 ,"The lawyer found a strict clause.",a1-part4-0158_例文の日本語訳
a1-part4-0159,drama,戯曲,「戯曲」を表す語。物事・考え・状態を表す基本名詞。 ,"The visitor noticed the drama near the doorway.",a1-part4-0159_例文の日本語訳
a1-part4-0160,clock,時計,「時計」を表す語。物事・考え・状態を表す基本名詞。 ,"The presenter pointed to the clock on the slide.",a1-part4-0160_例文の日本語訳
a1-part4-0161,ticket,切符,身近な物を表す「切符」。形・用途・持ち物の説明で使う。 ,"The checklist included the ticket at the end.",a1-part4-0161_例文の日本語訳
a1-part4-0162,shirt,シャツ,身近な物を表す「シャツ」。形・用途・持ち物の説明で使う。 ,"His shirt dried in the sun.",a1-part4-0162_例文の日本語訳
a1-part4-0163,bean,豆,食べ物・飲み物の「豆」。食事や好みの話で使う。 ,"The recipe calls for the bean at the end.",a1-part4-0163_例文の日本語訳
a1-part4-0164,seventy,70、七十,数を表す語。70、七十という数量や順番の表現に使う。 ,"Seventy guests arrived before noon.",a1-part4-0164_例文の日本語訳
a1-part4-0165,knife,ナイフ,身近な物を表す「ナイフ」。形・用途・持ち物の説明で使う。 ,"The knife cut the rope.",a1-part4-0165_例文の日本語訳
a1-part4-0166,lady,淑女,人・役割を表す「淑女」。家族・職業・立場を示す語。 ,"A client asked about the lady after lunch.",a1-part4-0166_例文の日本語訳
a1-part4-0167,eleven,11、十一,数を表す語。11、十一という数量や順番の表現に使う。 ,"Eleven guests arrived before noon.",a1-part4-0167_例文の日本語訳
a1-part4-0168,yesterday,きのう,時を表す「きのう」。予定・順序・期間を説明する時に使う。 ,"Yesterday we found a lost kitten.",a1-part4-0168_例文の日本語訳
a1-part4-0169,jet,噴出,「噴出」を表す語。物事・考え・状態を表す基本名詞。 ,"A jet crossed the blue sky.",a1-part4-0169_例文の日本語訳
a1-part4-0170,angry,おこった,「おこった」という性質を表す語。人・物・状況の様子を表す。 ,"An angry driver honked at the gate.",a1-part4-0170_例文の日本語訳
a1-part4-0171,bowl,どんぶり,身近な物を表す「どんぶり」。形・用途・持ち物の説明で使う。 ,"The kitchen smelled of bowl.",a1-part4-0171_例文の日本語訳
a1-part4-0172,coach,大型四輪馬車,人・役割を表す「大型四輪馬車」。家族・職業・立場を示す語。 ,"The coach moved quietly.",a1-part4-0172_例文の日本語訳
a1-part4-0173,dish,大皿,身近な物を表す「大皿」。形・用途・持ち物の説明で使う。 ,"The kitchen smelled of dish.",a1-part4-0173_例文の日本語訳
a1-part4-0174,terrible,恐ろしい,非常に悪い・ひどい状態。強い否定感を表す。 ,"The room felt terrible after the announcement.",a1-part4-0174_例文の日本語訳
a1-part4-0175,festival,祭り,特別な日を祝う催し。祭り・音楽祭などに使う。 ,"The photograph showed the festival in soft light.",a1-part4-0175_例文の日本語訳
a1-part4-0176,cheese,チーズ,食べ物・飲み物の「チーズ」。食事や好みの話で使う。 ,"The kitchen smelled of the cheese at noon.",a1-part4-0176_例文の日本語訳
a1-part4-0177,breakfast,朝食,時を表す「朝食」。予定・順序・期間を説明する時に使う。 ,"Breakfast is ready.",a1-part4-0177_例文の日本語訳
a1-part4-0178,hurry,急ぐ,急いで動くこと。急ぐ・急ぎの意味。 ,"Hurry before the gate closes.",a1-part4-0178_例文の日本語訳
a1-part4-0179,pop,ポンと音がする,「ポンと音がする」という動き・変化を表す語。人・物への働きかけを表す。 ,"The artist drew the pop in charcoal.",a1-part4-0179_例文の日本語訳
a1-part4-0180,garden,庭,場所を表す「庭」。行き先・位置・活動場所の説明に使う。 ,"The garden smelled of wet soil.",a1-part4-0180_例文の日本語訳
a1-part4-0181,ruler,支配者,身近な物を表す「支配者」。形・用途・持ち物の説明で使う。 ,"The ruler arrived early for the workshop.",a1-part4-0181_例文の日本語訳
a1-part4-0182,spell,～をつづる,「～をつづる」という動き・変化を表す語。人・物への働きかけを表す。 ,"Spell your name for the clerk.",a1-part4-0182_例文の日本語訳
a1-part4-0183,pink,桃色,主な意味は色の「桃色」。物の色や雰囲気を表す形容詞。 ,"The wall is pink.",a1-part4-0183_例文の日本語訳
a1-part4-0184,dictionary,辞書,身近な物を表す「辞書」。形・用途・持ち物の説明で使う。 ,"The dictionary sat beside the notebook.",a1-part4-0184_例文の日本語訳
a1-part4-0185,sad,悲しい,「悲しい」という性質を表す語。人・物・状況の様子を表す。 ,"A sad song filled the room.",a1-part4-0185_例文の日本語訳
a1-part4-0186,breathe,呼吸する,「呼吸する」という動き・変化を表す語。人・物への働きかけを表す。 ,"The kitchen smelled of the breathe at noon.",a1-part4-0186_例文の日本語訳
a1-part4-0187,bedroom,寝室,場所を表す「寝室」。行き先・位置・活動場所の説明に使う。 ,"The bedroom opened early for visitors.",a1-part4-0187_例文の日本語訳
a1-part4-0188,juice,汁,身近な物を表す「汁」。形・用途・持ち物の説明で使う。 ,"Orange juice spilled on the table.",a1-part4-0188_例文の日本語訳
a1-part4-0189,eighteen,18、十八,数を表す語。18、十八という数量や順番の表現に使う。 ,"Eighteen guests arrived before noon.",a1-part4-0189_例文の日本語訳
a1-part4-0190,aunt,おば,人・役割を表す「おば」。家族・職業・立場を示す語。 ,"A client asked about the aunt after lunch.",a1-part4-0190_例文の日本語訳
a1-part4-0191,concert,演奏会,身近な物を表す「演奏会」。形・用途・持ち物の説明で使う。 ,"The concert started with a drum solo.",a1-part4-0191_例文の日本語訳
a1-part4-0192,kick,～を蹴る,「～を蹴る」という動き・変化を表す語。人・物への働きかけを表す。 ,"Kick the ball toward the goal.",a1-part4-0192_例文の日本語訳
a1-part4-0193,smart,機敏な,頭がよい、洗練された。機器では高機能の意味もある。 ,"A smart scene opened the film.",a1-part4-0193_例文の日本語訳
a1-part4-0194,super,管理人,「管理人」という性質を表す語。人・物・状況の様子を表す。 ,"The teacher chose a super example.",a1-part4-0194_例文の日本語訳
a1-part4-0195,fourteen,14、十四,数を表す語。14、十四という数量や順番の表現に使う。 ,"Fourteen guests arrived before noon.",a1-part4-0195_例文の日本語訳
a1-part4-0196,eighty,80、八十,数を表す語。80、八十という数量や順番の表現に使う。 ,"Eighty guests arrived before noon.",a1-part4-0196_例文の日本語訳
a1-part4-0197,beef,牛肉,食べ物・飲み物の「牛肉」。食事や好みの話で使う。 ,"The beef moved quietly.",a1-part4-0197_例文の日本語訳
a1-part4-0198,cake,ケーキ,食べ物・飲み物の「ケーキ」。食事や好みの話で使う。 ,"The recipe calls for the cake at the end.",a1-part4-0198_例文の日本語訳
a1-part4-0199,sixteen,16、十六,数を表す語。16、十六という数量や順番の表現に使う。 ,"Sixteen guests arrived before noon.",a1-part4-0199_例文の日本語訳
a1-part4-0200,grammar,文法,言語の組み立てルール。文法を表す。 ,"Grammar helps sentences work.",a1-part4-0200_例文の日本語訳
