id,english,japanese,detail,sample,sample-jpn
a1-part2-0001,keep,～をずっと持っている,手元や状態を保つイメージ。約束を守る意味もある。 ,"Keep the receipt in your bag.",a1-part2-0001_例文の日本語訳
a1-part2-0002,health,健康,体や心がよい状態にあること。健康状態全般を表す。 ,"Health improves with regular sleep.",a1-part2-0002_例文の日本語訳
a1-part2-0003,above,～の上方に,基準より高い位置にあるイメージ。数値が上回る意味もある。 ,"Clouds gathered above the mountain.",a1-part2-0003_例文の日本語訳
a1-part2-0004,never,決して～ない,一度も起こらない強い否定。経験の否定にも使う。 ,"He never skips breakfast.",a1-part2-0004_例文の日本語訳
a1-part2-0005,open,～を開く,閉じたものを開けるイメージ。店の営業開始にも使う。 ,"Open the window after painting.",a1-part2-0005_例文の日本語訳
a1-part2-0006,turn,～を回す,向きや状態を変えるイメージ。順番の意味もある。 ,"Turn the handle clockwise.",a1-part2-0006_例文の日本語訳
a1-part2-0007,help,～を手伝う,困っている人を助けるイメージ。役立つ意味もある。 ,"Help the child cross the street.",a1-part2-0007_例文の日本語訳
a1-part2-0008,class,授業,同じ種類のまとまり。授業・学級・階級を表す。 ,"The class visited the science museum.",a1-part2-0008_例文の日本語訳
a1-part2-0009,side,側面,物の横や一方の側。立場・味方の意味もある。 ,"The side gate opens onto the alley.",a1-part2-0009_例文の日本語訳
a1-part2-0010,feel,～を感じる,体や心で感じ取るイメージ。触って分かる意味もある。 ,"Feel the fabric before you buy it.",a1-part2-0010_例文の日本語訳
a1-part2-0011,until,～まで,ある時点まで続くイメージ。終わりの期限を示す。 ,"Wait until the light turns green.",a1-part2-0011_例文の日本語訳
a1-part2-0012,again,再び,同じことがもう一度起こるイメージ。繰り返しを表す。 ,"Please read the sentence again.",a1-part2-0012_例文の日本語訳
a1-part2-0013,design,デザイン,目的に合わせて形を考えること。設計・図案も表す。 ,"Workers need to design a poster safely.",a1-part2-0013_例文の日本語訳
a1-part2-0014,four,4,数字の4。四つの数や順番を表す基本語。 ,"Four guests arrived before noon.",a1-part2-0014_例文の日本語訳
a1-part2-0015,body,身体,人や動物の体全体。物の本体という意味もある。 ,"The body needs water after exercise.",a1-part2-0015_例文の日本語訳
a1-part2-0016,age,年齢,生まれてからの年数。時代・老いる意味もある。 ,"Age changed the flavor of the cheese.",a1-part2-0016_例文の日本語訳
a1-part2-0017,student,学生,学校で学ぶ人。大学生だけでなく生徒にも使える。 ,"The student measured the plant each day.",a1-part2-0017_例文の日本語訳
a1-part2-0018,light,光,明るさを生むもの。軽い・薄いという意味もある。 ,"Light spilled under the door.",a1-part2-0018_例文の日本語訳
a1-part2-0019,month,月,一年を分ける単位。期間としての一か月を表す。 ,"The month brought warmer evenings.",a1-part2-0019_例文の日本語訳
a1-part2-0020,put,～を置く,物をある場所に移して置く。状態にする意味もある。 ,"Put the glasses on the shelf.",a1-part2-0020_例文の日本語訳
a1-part2-0021,date,日付,暦上の特定の日。約束やデートの意味もある。 ,"The date is printed on the ticket.",a1-part2-0021_例文の日本語訳
a1-part2-0022,paper,紙,紙そのもの。書類・論文・新聞の意味にも広がる。 ,"The paper tore at the corner.",a1-part2-0022_例文の日本語訳
a1-part2-0023,carry,～を運ぶ,持って移動させるイメージ。責任を負う意味もある。 ,"Carry the boxes one at a time.",a1-part2-0023_例文の日本語訳
a1-part2-0024,history,歴史,過去に起きた出来事の流れ。経歴の意味もある。 ,"History explains the old border.",a1-part2-0024_例文の日本語訳
a1-part2-0025,move,動く,位置や気持ちが動くイメージ。引っ越す意味もある。 ,"Move the chair away from the heater.",a1-part2-0025_例文の日本語訳
a1-part2-0026,often,しばしば,同じことが多い頻度で起こることを表す副詞。 ,"Deer often cross this road.",a1-part2-0026_例文の日本語訳
a1-part2-0027,bank,銀行,お金を扱う場所。川の土手という意味もある。 ,"The bank opens at nine.",a1-part2-0027_例文の日本語訳
a1-part2-0028,special,特別な,普通とは違い、特に大切・限定されたイメージ。 ,"A special stamp marked the envelope.",a1-part2-0028_例文の日本語訳
a1-part2-0029,reason,理由,なぜそうなるかの根拠。理性という意味もある。 ,"Give one reason for your choice.",a1-part2-0029_例文の日本語訳
a1-part2-0030,close,～を閉じる,開いているものを閉める。近いという形容詞もある。 ,"Close the lid before shaking the bottle.",a1-part2-0030_例文の日本語訳
a1-part2-0031,face,顔,人の顔・表面。困難に向き合う意味もある。 ,"His face brightened at the news.",a1-part2-0031_例文の日本語訳
a1-part2-0032,describe,～を描写する,特徴を言葉で説明するイメージ。様子を詳しく述べる。 ,"Describe the painting in three words.",a1-part2-0032_例文の日本語訳
a1-part2-0033,hour,時間,60分の単位。時刻や労働時間を表すこともある。 ,"The meeting lasted one hour.",a1-part2-0033_例文の日本語訳
a1-part2-0034,add,～を加える,何かを足して増やすイメージ。合計する意味もある。 ,"Add salt slowly.",a1-part2-0034_例文の日本語訳
a1-part2-0035,free,自由な,縛られていない状態。無料の意味もよく使う。 ,"A free concert filled the park.",a1-part2-0035_例文の日本語訳
a1-part2-0036,run,走る,人・物が速く進む。機械や店が動く意味もある。 ,"Run along the river path.",a1-part2-0036_例文の日本語訳
a1-part2-0037,live,生きる,命がある、生活するイメージ。生放送の意味もある。 ,"Many foxes live near the river.",a1-part2-0037_例文の日本語訳
a1-part2-0038,try,～を試す,うまくいくかやってみる。努力する意味もある。 ,"Try the smaller size first.",a1-part2-0038_例文の日本語訳
a1-part2-0039,practice,練習,上達のために繰り返すこと。実践・業務の意味もある。 ,"Piano practice starts after school.",a1-part2-0039_例文の日本語訳
a1-part2-0040,full,いっぱいの,中身が満ちている状態。完全なという意味もある。 ,"The basket was full of apples.",a1-part2-0040_例文の日本語訳
a1-part2-0041,let,～させる,相手に行動を許す・可能にするイメージ。 ,"Let me help.",a1-part2-0041_例文の日本語訳
a1-part2-0042,young,若い,年齢が低い、または新しいイメージ。未熟の意味もある。 ,"A young fox crossed the road.",a1-part2-0042_例文の日本語訳
a1-part2-0043,five,5,数字の5。五つの数や順番を表す基本語。 ,"Five guests arrived.",a1-part2-0043_例文の日本語訳
a1-part2-0044,white,白い,白色の状態。空白・白人を表す場合もある。 ,"The wall is white.",a1-part2-0044_例文の日本語訳
a1-part2-0045,meet,～に会う,人と出会うイメージ。条件を満たす意味もある。 ,"Meet the guide at the harbor.",a1-part2-0045_例文の日本語訳
a1-part2-0046,always,いつも,例外なく毎回そうであることを表す副詞。 ,"She always locks the studio door.",a1-part2-0046_例文の日本語訳
a1-part2-0047,due,予定の,期限・予定が来ている状態。支払期限にも使う。 ,"The rent is due tomorrow.",a1-part2-0047_例文の日本語訳
a1-part2-0048,building,建物,人が使うために建てられたもの。建築中の意味もある。 ,"The building shook during the storm.",a1-part2-0048_例文の日本語訳
a1-part2-0049,either,どちらか一方の,二つのうち一方を指す。否定文では「～もまたない」。 ,"Either path reaches the cabin.",a1-part2-0049_例文の日本語訳
a1-part2-0050,around,～の周りに,囲む・近辺にあるイメージ。約・だいたいの意味もある。 ,"Children ran around the fountain.",a1-part2-0050_例文の日本語訳
a1-part2-0051,start,始まる,動き出すイメージ。始める・出発する意味もある。 ,"Start the engine after the signal.",a1-part2-0051_例文の日本語訳
a1-part2-0052,believe,～を信じる,本当だと思う、信頼するイメージ。意見を述べる時にも使う。 ,"Believe the warning signs on the cliff.",a1-part2-0052_例文の日本語訳
a1-part2-0053,yet,まだ,今の時点では未完了のイメージ。否定文や疑問文でよく使う。 ,"The package has not arrived yet.",a1-part2-0053_例文の日本語訳
a1-part2-0054,read,～を読む,文字や情報を読み取るイメージ。readは過去形も同形。 ,"Read the warning on the label.",a1-part2-0054_例文の日本語訳
a1-part2-0055,why,なぜ,理由をたずねる疑問語。関係副詞としても使う。 ,"Why are you late?",a1-part2-0055_例文の日本語訳
a1-part2-0056,cover,～を覆う,上からかぶせるイメージ。扱う・取材する意味もある。 ,"Cover the basket with a cloth.",a1-part2-0056_例文の日本語訳
a1-part2-0057,care,世話,大切に思い注意を向けること。心配・介護も表す。 ,"Tourists photographed the care near the station.",a1-part2-0057_例文の日本語訳
a1-part2-0058,eye,目,見る器官。注意・視線・観察力の意味にも広がる。 ,"One eye caught the tiny movement.",a1-part2-0058_例文の日本語訳
a1-part2-0059,room,部屋,人が使う空間。余地・空きという意味もある。 ,"The room echoed after the door closed.",a1-part2-0059_例文の日本語訳
a1-part2-0060,review,～を見直す,もう一度確認するイメージ。批評・復習の意味もある。 ,"Review the notes before the test.",a1-part2-0060_例文の日本語訳
a1-part2-0061,stand,立つ,足で体を支える。耐える・立場を取る意味もある。 ,"Stand behind the yellow line.",a1-part2-0061_例文の日本語訳
a1-part2-0062,once,一度,一回だけ、または過去のある時を表す副詞。 ,"I met him once at the harbor.",a1-part2-0062_例文の日本語訳
a1-part2-0063,sale,販売,売ること。特売・売上の意味にも広がる。 ,"The manager reviewed the sale before the meeting.",a1-part2-0063_例文の日本語訳
a1-part2-0064,away,離れて,基準の場所から離れるイメージ。別方向へ去る意味もある。 ,"He walked away.",a1-part2-0064_例文の日本語訳
a1-part2-0065,officer,役人,組織で役職を持つ人。警官・公務員・役員を表す。 ,"A client asked about the officer after lunch.",a1-part2-0065_例文の日本語訳
a1-part2-0066,money,お金,物やサービスと交換する価値。現金だけでなく資金も含む。 ,"Money disappeared from the drawer.",a1-part2-0066_例文の日本語訳
a1-part2-0067,kind,親切な,思いやりがある状態。名詞では「種類」の意味。 ,"This kind of soil holds water.",a1-part2-0067_例文の日本語訳
a1-part2-0068,science,科学,観察や実験で自然を理解する学問。理科の意味もある。 ,"Science changed the way farmers worked.",a1-part2-0068_例文の日本語訳
a1-part2-0069,page,ページ,本や画面の一面。ウェブページの意味もある。 ,"Turn to page ten.",a1-part2-0069_例文の日本語訳
a1-part2-0070,street,通り,町の道。住所や店が並ぶ生活空間のイメージ。 ,"The street filled with festival music.",a1-part2-0070_例文の日本語訳
a1-part2-0071,play,遊ぶ,楽しく行動する。スポーツをする・演奏する意味もある。 ,"Play the melody softly.",a1-part2-0071_例文の日本語訳
a1-part2-0072,short,短い,長さや時間が少ない状態。不足している意味もある。 ,"A short path led to the beach.",a1-part2-0072_例文の日本語訳
a1-part2-0073,foreign,外国の,自分の国の外に属するイメージ。異質な意味にも広がる。 ,"Foreign guests signed the visitor book.",a1-part2-0073_例文の日本語訳
a1-part2-0074,letter,手紙,相手に送る文章。アルファベットの文字も表す。 ,"The letter arrived with a sea stamp.",a1-part2-0074_例文の日本語訳
a1-part2-0075,something,何か,具体名が分からない物事を指す代名詞。 ,"Something arrived early.",a1-part2-0075_例文の日本語訳
a1-part2-0076,hear,～が聞こえる,音が耳に入るイメージ。知らせを聞く意味もある。 ,"Hear the bells across the valley.",a1-part2-0076_例文の日本語訳
a1-part2-0077,art,芸術,美しさや表現を形にしたもの。技術・技巧も表す。 ,"Art filled the old warehouse.",a1-part2-0077_例文の日本語訳
a1-part2-0078,article,記事,新聞やウェブの記事。文法では冠詞の意味もある。 ,"The gallery displayed the article near the door.",a1-part2-0078_例文の日本語訳
a1-part2-0079,later,後で,今より後の時点。比較では「より遅い」を表す。 ,"We can discuss it later.",a1-part2-0079_例文の日本語訳
a1-part2-0080,food,食べ物,人や動物が食べるもの。食料全般を表す。 ,"The food smelled of garlic.",a1-part2-0080_例文の日本語訳
a1-part2-0081,love,愛,強く大切に思う気持ち。動詞では大好き・愛する。 ,"Love shaped every letter she wrote.",a1-part2-0081_例文の日本語訳
a1-part2-0082,week,週,7日間の期間。今週・来週など時間のまとまり。 ,"The week ended with a concert.",a1-part2-0082_例文の日本語訳
a1-part2-0083,half,半分,全体を二つに分けた一方。半分の量や時間を表す。 ,"Cut the apple in half.",a1-part2-0083_例文の日本語訳
a1-part2-0084,grow,成長する,大きくなる・増えるイメージ。育てる意味もある。 ,"Tomatoes grow well in this soil.",a1-part2-0084_例文の日本語訳
a1-part2-0085,college,大学,主に高等教育機関。米英で使い方に差がある。 ,"My sister started college in April.",a1-part2-0085_例文の日本語訳
a1-part2-0086,list,リスト,項目を並べたもの。動詞では一覧に載せる。 ,"Write the items on the list.",a1-part2-0086_例文の日本語訳
a1-part2-0087,file,ファイル,書類やデータのまとまり。動詞では保管・提出する。 ,"The file contained the missing receipt.",a1-part2-0087_例文の日本語訳
a1-part2-0088,mind,心,考えや意識の働き。気にするという動詞にもなる。 ,"A strange idea crossed his mind.",a1-part2-0088_例文の日本語訳
a1-part2-0089,language,言語,人が考えや情報を伝える仕組み。言葉遣いも含む。 ,"Language changes as people move.",a1-part2-0089_例文の日本語訳
a1-part2-0090,difference,違い,二つ以上を比べた時の差。意見の相違にも使う。 ,"The difference shows under bright light.",a1-part2-0090_例文の日本語訳
a1-part2-0091,ground,地面,足元の土地。根拠・分野という意味もある。 ,"Frost covered the ground.",a1-part2-0091_例文の日本語訳
a1-part2-0092,size,大きさ,物の寸法や規模。服などのサイズにも使う。 ,"Size matters in a small suitcase.",a1-part2-0092_例文の日本語訳
a1-part2-0093,real,本物の,想像でなく実際に存在するイメージ。真の意味もある。 ,"A real wolf crossed the road.",a1-part2-0093_例文の日本語訳
a1-part2-0094,along,～に沿って,線や道にしたがって進むイメージ。一緒に進む感じもある。 ,"We walked along the canal.",a1-part2-0094_例文の日本語訳
a1-part2-0095,together,一緒に,別々のものが同じ場所・状態にまとまるイメージ。 ,"The children walked together to school.",a1-part2-0095_例文の日本語訳
a1-part2-0096,late,遅い,予定や普通の時より後。故人を表す用法もある。 ,"A late bus saved us a long walk.",a1-part2-0096_例文の日本語訳
a1-part2-0097,answer,答え,質問や問題への返事。動詞では答える・応じる。 ,"The answer was hidden in the diagram.",a1-part2-0097_例文の日本語訳
a1-part2-0098,idea,考え,頭に浮かぶ内容。発想・意見・理解の意味もある。 ,"A fresh idea changed the design.",a1-part2-0098_例文の日本語訳
a1-part2-0099,church,教会,キリスト教の礼拝場所。教会組織を表すこともある。 ,"The church opened early for visitors.",a1-part2-0099_例文の日本語訳
a1-part2-0100,share,分け前,全体の一部。動詞では共有する・分ける。 ,"Share the map with the group.",a1-part2-0100_例文の日本語訳
a1-part2-0101,almost,ほとんど,完全ではないが非常に近い状態を表す副詞。 ,"The jar is almost empty.",a1-part2-0101_例文の日本語訳
a1-part2-0102,river,川,自然に流れる水の道。大きな流れのイメージ。 ,"The river carried leaves downstream.",a1-part2-0102_例文の日本語訳
a1-part2-0103,black,黒い,黒色の状態。暗い・不吉な意味に広がることもある。 ,"The wall is black.",a1-part2-0103_例文の日本語訳
a1-part2-0104,bear,クマ,動物のクマ。動詞では耐える・産むの意味もある。 ,"The bear moved quietly.",a1-part2-0104_例文の日本語訳
a1-part2-0105,already,すでに,予想より前に完了している感じを表す副詞。 ,"The guests had already left.",a1-part2-0105_例文の日本語訳
a1-part2-0106,near,～の近くに,距離や時間が近いイメージ。形容詞・前置詞で使う。 ,"A bakery opened near the station.",a1-part2-0106_例文の日本語訳
a1-part2-0107,speak,話す,声で言葉を出す。言語を話せる意味にも使う。 ,"Speak clearly into the microphone.",a1-part2-0107_例文の日本語訳
a1-part2-0108,future,未来,これから先の時間。将来の可能性や予定を表す。 ,"The future felt open after graduation.",a1-part2-0108_例文の日本語訳
a1-part2-0109,self,自己,自分自身という主な意味。self-で自分に関する語を作る。 ,"Her sense of self grew stronger.",a1-part2-0109_例文の日本語訳
a1-part2-0110,meeting,会議,人が集まって話す場。出会い・集会の意味もある。 ,"The meeting ended before noon.",a1-part2-0110_例文の日本語訳
a1-part2-0111,step,一歩,足を進める一動作。段階・手順の意味もある。 ,"Watch your step on the icy stairs.",a1-part2-0111_例文の日本語訳
a1-part2-0112,nothing,何もない,物事が一つもないこと。重要でないという意味もある。 ,"Nothing arrived early.",a1-part2-0112_例文の日本語訳
a1-part2-0113,worker,労働者,仕事をする人。職場で働く人全般を表す。 ,"The worker arrived early.",a1-part2-0113_例文の日本語訳
a1-part2-0114,past,過去,今より前の時間。通り過ぎる意味の前置詞にもなる。 ,"The past still shaped the village.",a1-part2-0114_例文の日本語訳
a1-part2-0115,father,父,男性の親。創始者・神父の意味もある。 ,"My father fixed the bicycle.",a1-part2-0115_例文の日本語訳
a1-part2-0116,address,住所,場所を示す情報。演説する・対処する意味もある。 ,"Write the address clearly on the envelope.",a1-part2-0116_例文の日本語訳
a1-part2-0117,True,本当の,事実に合っている状態。忠実な・正確な意味もある。 ,"The true story emerged years later.",a1-part2-0117_例文の日本語訳
a1-part2-0118,friend,友人,親しい人。SNSなどの友達にも使われる。 ,"A friend saved me a seat.",a1-part2-0118_例文の日本語訳
a1-part2-0119,mother,母,女性の親。生み出すもの・源という意味もある。 ,"My mother called after dinner.",a1-part2-0119_例文の日本語訳
a1-part2-0120,fire,火,燃えて熱や光を出すもの。解雇する意味もある。 ,"Fire warmed the stone room.",a1-part2-0120_例文の日本語訳
a1-part2-0121,build,～を建てる,材料を組み合わせて作るイメージ。体力や関係を築く意味もある。 ,"Build a shelter before dark.",a1-part2-0121_例文の日本語訳
a1-part2-0122,story,話,出来事を順に語るもの。階・記事の意味もある。 ,"The story begins in a fishing village.",a1-part2-0122_例文の日本語訳
a1-part2-0123,teacher,先生,知識や技能を教える人。学校以外でも使える。 ,"The teacher drew a map on the board.",a1-part2-0123_例文の日本語訳
a1-part2-0124,job,仕事,報酬や役割として行う仕事。任務の意味もある。 ,"He found a job at the airport.",a1-part2-0124_例文の日本語訳
a1-part2-0125,library,図書館,本や資料を集めて利用する場所。データ集の意味もある。 ,"The library closes at six.",a1-part2-0125_例文の日本語訳
a1-part2-0126,site,場所,特定の場所。工事現場・ウェブサイトの意味もある。 ,"The site opened early for visitors.",a1-part2-0126_例文の日本語訳
a1-part2-0127,night,夜,日没後の暗い時間帯。一晩を表すこともある。 ,"The night smelled of rain.",a1-part2-0127_例文の日本語訳
a1-part2-0128,talk,話す,言葉でやり取りする。名詞では会話・講演。 ,"Talk to the coach after practice.",a1-part2-0128_例文の日本語訳
a1-part2-0129,whose,だれの,所有者をたずねる疑問語。関係詞としても使う。 ,"Whose arrived early.",a1-part2-0129_例文の日本語訳
a1-part2-0130,town,町,村より大きく都市より小さい集落。主な意味街の意味もある。 ,"The town opened early for visitors.",a1-part2-0130_例文の日本語訳
a1-part2-0131,discuss,～を話し合う,ある話題について意見を出し合うイメージ。 ,"Discuss the plan after lunch.",a1-part2-0131_例文の日本語訳
a1-part2-0132,six,6,数字の6。六つの数や順番を表す基本語。 ,"Six guests arrived before noon.",a1-part2-0132_例文の日本語訳
a1-part2-0133,event,出来事,起こったこと。催し・競技種目の意味もある。 ,"The event filled the town square.",a1-part2-0133_例文の日本語訳
a1-part2-0134,king,王,国を治める男性の君主。最重要人物の比喩にもなる。 ,"The king ruled wisely.",a1-part2-0134_例文の日本語訳
a1-part2-0135,learn,～を学ぶ,知識や技能を身につける。知るようになる意味もある。 ,"Learn the route before the hike.",a1-part2-0135_例文の日本語訳
a1-part2-0136,usually,普通は,多くの場合そうであることを表す頻度副詞。 ,"The cafe usually opens at seven.",a1-part2-0136_例文の日本語訳
a1-part2-0137,hope,～を望む,よいことを期待する気持ち。名詞では希望。 ,"Hope returned after the rescue signal.",a1-part2-0137_例文の日本語訳
a1-part2-0138,strong,強い,力や程度が大きい状態。味・意見・証拠にも使う。 ,"The coffee is strong.",a1-part2-0138_例文の日本語訳
a1-part2-0139,personal,個人的な,個人に関係するイメージ。私的な意味もある。 ,"Keep personal notes in a separate folder.",a1-part2-0139_例文の日本語訳
a1-part2-0140,draw,～を描く,線を引いて表す。引く・引き分けの意味もある。 ,"Draw a circle around the error.",a1-part2-0140_例文の日本語訳
a1-part2-0141,code,コード,記号化された情報。暗号・規則・プログラムを表す。 ,"The technician tested the code in the lab.",a1-part2-0141_例文の日本語訳
a1-part2-0142,below,～の下方に,基準より低い位置にあるイメージ。数値が下回る意味もある。 ,"Fish moved below the clear ice.",a1-part2-0142_例文の日本語訳
a1-part2-0143,stage,舞台,物事が行われる場。段階・時期という意味もある。 ,"The actor stepped onto the stage.",a1-part2-0143_例文の日本語訳
a1-part2-0144,station,駅,人・物が集まる拠点。署・放送局の意味もある。 ,"The station clock stopped at noon.",a1-part2-0144_例文の日本語訳
a1-part2-0145,sign,しるし,何かを示す印。署名する・標識の意味もある。 ,"The sign warned drivers about ice.",a1-part2-0145_例文の日本語訳
a1-part2-0146,car,車,道路を走る乗り物。鉄道車両を指すこともある。 ,"The car stopped at the ferry gate.",a1-part2-0146_例文の日本語訳
a1-part2-0147,heart,心臓,体で血を送る主な意味。心・気持ちの意味もある。 ,"Her heart beat faster at the news.",a1-part2-0147_例文の日本語訳
a1-part2-0148,sell,～を売る,物やサービスをお金と交換する。説得する意味もある。 ,"Sell the old bike at the market.",a1-part2-0148_例文の日本語訳
a1-part2-0149,agree,同意する,意見が同じになるイメージ。条件を受け入れる意味もある。 ,"I agree with you.",a1-part2-0149_例文の日本語訳
a1-part2-0150,technology,技術,科学を使った実用的な技術。機械やITにも使う。 ,"Technology changed the fishing boats.",a1-part2-0150_例文の日本語訳
a1-part2-0151,cut,～を切る,刃物などで分けるイメージ。減らす・中断する意味もある。 ,"Cut the rope with a sharp knife.",a1-part2-0151_例文の日本語訳
a1-part2-0152,character,性格,人・物の特徴。登場人物・文字の意味もある。 ,"The main character changes in chapter three.",a1-part2-0152_例文の日本語訳
