id,english,japanese,detail,sample,sample-jpn
a1-part3-0141,repeat,～を繰り返す,「～を繰り返す」という動き・変化を表す語。人・物への働きかけを表す。 ,"They learned to repeat the sauce during training.",a1-part3-0141_例文の日本語訳
a1-part3-0142,evening,夕方,時を表す「夕方」。予定・順序・期間を説明する時に使う。 ,"Evening shadows crossed the garden.",a1-part3-0142_例文の日本語訳
a1-part3-0143,slow,遅い,「遅い」という性質を表す語。人・物・状況の様子を表す。 ,"A slow train climbed the hill.",a1-part3-0143_例文の日本語訳
a1-part3-0144,circle,円,丸く囲む形。円・仲間の輪・囲む動詞にも使う。 ,"Draw a circle around the answer.",a1-part3-0144_例文の日本語訳
a1-part3-0145,pair,組,2つで1組になるもの。靴・人・道具などに使う。 ,"A pair of shoes sat by the door.",a1-part3-0145_例文の日本語訳
a1-part3-0146,plane,平面,身近な物を表す「平面」。形・用途・持ち物の説明で使う。 ,"The plane landed in heavy rain.",a1-part3-0146_例文の日本語訳
a1-part3-0147,clean,きれいな；～を掃除する,汚れがない状態。掃除する動詞にもなる。「きれいな」の意味もある。 ,"Clean towels waited on the shelf.",a1-part3-0147_例文の日本語訳
a1-part3-0148,pick,～を選ぶ；摘む,いくつかから選び取る感じ。選ぶ・摘む・つまむに使う。 ,"Pick a card.",a1-part3-0148_例文の日本語訳
a1-part3-0149,dog,犬,動物の「犬」。種類や特徴を言う基本名詞。 ,"The dog slept near the stove.",a1-part3-0149_例文の日本語訳
a1-part3-0150,phone,電話,身近な物を表す「電話」。形・用途・持ち物の説明で使う。 ,"The phone buzzed inside her coat.",a1-part3-0150_例文の日本語訳
a1-part3-0151,shop,小売店,場所を表す「小売店」。行き先・位置・活動場所の説明に使う。 ,"The shop sells handmade baskets.",a1-part3-0151_例文の日本語訳
a1-part3-0152,interview,面接,「面接」という動き・変化を表す語。人・物への働きかけを表す。 ,"The interview lasted twenty minutes.",a1-part3-0152_例文の日本語訳
a1-part3-0153,brain,脳,「脳」を表す語。物事・考え・状態を表す基本名詞。 ,"The librarian set the brain near the entrance.",a1-part3-0153_例文の日本語訳
a1-part3-0154,nine,9、九,数を表す語。9、九という数量や順番の表現に使う。 ,"Nine guests arrived before noon.",a1-part3-0154_例文の日本語訳
a1-part3-0155,sister,妹,人・役割を表す「妹」。家族・職業・立場を示す語。 ,"The invoice listed the sister clearly.",a1-part3-0155_例文の日本語訳
a1-part3-0156,camp,野営地,場所を表す「野営地」。行き先・位置・活動場所の説明に使う。 ,"We reached camp before dark.",a1-part3-0156_例文の日本語訳
a1-part3-0157,dream,夢,「夢」を表す語。物事・考え・状態を表す基本名詞。 ,"The dream stayed with him all morning.",a1-part3-0157_例文の日本語訳
a1-part3-0158,hotel,ホテル,場所を表す「ホテル」。行き先・位置・活動場所の説明に使う。 ,"The hotel faced the old canal.",a1-part3-0158_例文の日本語訳
a1-part3-0159,spot,斑点,小さな点や場所。斑点・地点・見つける動詞にも使う。 ,"A red spot appeared on the wall.",a1-part3-0159_例文の日本語訳
a1-part3-0160,chair,いす,身近な物を表す「いす」。形・用途・持ち物の説明で使う。 ,"A chair scraped across the floor.",a1-part3-0160_例文の日本語訳
a1-part3-0161,newspaper,新聞,身近な物を表す「新聞」。形・用途・持ち物の説明で使う。 ,"The newspaper arrived at dawn.",a1-part3-0161_例文の日本語訳
a1-part3-0162,listen,聞く,「聞く」という動き・変化を表す語。人・物への働きかけを表す。 ,"Listen for the click of the lock.",a1-part3-0162_例文の日本語訳
a1-part3-0163,forget,～を忘れる,「～を忘れる」という動き・変化を表す語。人・物への働きかけを表す。 ,"Forget the password, and you wait outside.",a1-part3-0163_例文の日本語訳
a1-part3-0164,birth,誕生,生まれること。誕生・始まりを表す。 ,"The baby's birth was celebrated.",a1-part3-0164_例文の日本語訳
a1-part3-0165,bone,骨,身近な物を表す「骨」。形・用途・持ち物の説明で使う。 ,"The dog buried a bone.",a1-part3-0165_例文の日本語訳
a1-part3-0166,everyone,みんな、すべての人,「みんな、すべての人」を表す語。物事・考え・状態を表す基本名詞。 ,"Everyone arrived early.",a1-part3-0166_例文の日本語訳
a1-part3-0167,partner,相手,一緒に行動する相手。仕事・競技・人生の相棒にも使う。 ,"They tried to partner the proposal after lunch.",a1-part3-0167_例文の日本語訳
a1-part3-0168,flower,花,身近な物を表す「花」。形・用途・持ち物の説明で使う。 ,"A flower opened beside the path.",a1-part3-0168_例文の日本語訳
a1-part3-0169,happy,幸福な,「幸福な」という性質を表す語。人・物・状況の様子を表す。 ,"Happy children chased bubbles.",a1-part3-0169_例文の日本語訳
a1-part3-0170,leg,脚,体の一部「脚」を表す語。位置や動きの説明で使う。 ,"His leg hurt after the climb.",a1-part3-0170_例文の日本語訳
a1-part3-0171,cry,泣く,「泣く」という動き・変化を表す語。人・物への働きかけを表す。 ,"The guests may cry after dinner.",a1-part3-0171_例文の日本語訳
a1-part3-0172,song,歌,「歌」を表す語。物事・考え・状態を表す基本名詞。 ,"The song reminded her of summer.",a1-part3-0172_例文の日本語訳
a1-part3-0173,egg,卵,食べ物・飲み物の「卵」。食事や好みの話で使う。 ,"The recipe calls for the egg at the end.",a1-part3-0173_例文の日本語訳
a1-part3-0174,sugar,砂糖,食べ物・飲み物の「砂糖」。食事や好みの話で使う。 ,"The chef added the sugar to the bowl.",a1-part3-0174_例文の日本語訳
a1-part3-0175,gift,贈り物,身近な物を表す「贈り物」。形・用途・持ち物の説明で使う。 ,"She wrapped the gift in blue paper.",a1-part3-0175_例文の日本語訳
a1-part3-0176,ice,氷,食べ物・飲み物の「氷」。食事や好みの話で使う。 ,"The kitchen smelled of the ice at noon.",a1-part3-0176_例文の日本語訳
a1-part3-0177,beautiful,美しい,「美しい」という性質を表す語。人・物・状況の様子を表す。 ,"A beautiful mural covered the station wall.",a1-part3-0177_例文の日本語訳
a1-part3-0178,push,～を押す,「～を押す」という動き・変化を表す語。人・物への働きかけを表す。 ,"Push the door until it clicks.",a1-part3-0178_例文の日本語訳
a1-part3-0179,cool,涼しい,温度が低めの感覚。落ち着いた、かっこいいにも広がる。 ,"A cool wind entered the room.",a1-part3-0179_例文の日本語訳
a1-part3-0180,weather,天気,空の状態全体。晴雨・気温・風などをまとめて指す。 ,"Weather changed the sailing plan.",a1-part3-0180_例文の日本語訳
a1-part3-0181,boat,小型の船,身近な物を表す「小型の船」。形・用途・持ち物の説明で使う。 ,"Tourists photographed the boat near the station.",a1-part3-0181_例文の日本語訳
a1-part3-0182,hole,穴,中が抜けた空間。穴・欠点・空白にも使う。 ,"A rabbit vanished into the hole.",a1-part3-0182_例文の日本語訳
a1-part3-0183,thin,薄い,厚みや幅が少ない状態。薄い・細い・濃くないに使う。 ,"Thin ice covered the pond.",a1-part3-0183_例文の日本語訳
a1-part3-0184,corner,かど,2つの辺が会う所。角・曲がり角・追い詰める意味もある。 ,"The cafe stands on the corner.",a1-part3-0184_例文の日本語訳
a1-part3-0185,drink,～を飲む；飲み物,「～を飲む；飲み物」という動き・変化を表す語。人・物への働きかけを表す。 ,"Drink water before the race.",a1-part3-0185_例文の日本語訳
a1-part3-0186,solve,～を解く,「～を解く」という動き・変化を表す語。人・物への働きかけを表す。 ,"Solve the puzzle before lunch.",a1-part3-0186_例文の日本語訳
a1-part3-0187,dress,服；～に服を着せる,「衣服」から、ワンピース、服を着せる動詞にも使う。 ,"She wore a red dress to the party.",a1-part3-0187_例文の日本語訳
a1-part3-0188,maybe,たぶん,確信が弱い時の「たぶん」。文全体にかかる副詞。 ,"Maybe, the route needs more time.",a1-part3-0188_例文の日本語訳
a1-part3-0189,farmer,農場経営者,人・役割を表す「農場経営者」。家族・職業・立場を示す語。 ,"A client asked about the farmer after lunch.",a1-part3-0189_例文の日本語訳
a1-part3-0190,factory,工場,物を大量に作る場所。工場を表す基本語。 ,"The factory makes paper boxes.",a1-part3-0190_例文の日本語訳
a1-part3-0191,excellent,すぐれた,「すぐれた」という性質を表す語。人・物・状況の様子を表す。 ,"The result was excellent.",a1-part3-0191_例文の日本語訳
a1-part3-0192,ideal,理想,理想としてぴったりな状態。名詞「理想」にも使う。 ,"The quiet room was ideal for study.",a1-part3-0192_例文の日本語訳
a1-part3-0193,shoulder,肩,体の一部「肩」を表す語。位置や動きの説明で使う。 ,"His shoulder hurt after tennis.",a1-part3-0193_例文の日本語訳
a1-part3-0194,straight,まっすぐな,曲がらずまっすぐ。率直な・連続した意味にも使う。 ,"Draw a straight line across the page.",a1-part3-0194_例文の日本語訳
a1-part3-0195,shake,～を振る；揺れる,小刻みに動かす感じ。振る・揺れる・握手にも使う。 ,"Shake the bottle before opening it.",a1-part3-0195_例文の日本語訳
a1-part3-0196,laugh,笑う,「笑う」という動き・変化を表す語。人・物への働きかけを表す。 ,"The hikers will laugh before sunset.",a1-part3-0196_例文の日本語訳
a1-part3-0197,paint,ペンキ,「ペンキ」という動き・変化を表す語。人・物への働きかけを表す。 ,"Paint the fence before it rains.",a1-part3-0197_例文の日本語訳
a1-part3-0198,magazine,雑誌,身近な物を表す「雑誌」。形・用途・持ち物の説明で使う。 ,"She bought a magazine at the station.",a1-part3-0198_例文の日本語訳
a1-part3-0199,poem,詩,言葉で気持ちや景色を表す作品。詩・詩歌を指す。 ,"The artist captured the poem in the sketch.",a1-part3-0199_例文の日本語訳
a1-part3-0200,carefully,注意深く,注意を向けて行う様子。ミスを避ける丁寧さを表す。 ,"The team worked carefully through the night.",a1-part3-0200_例文の日本語訳
