id,english,japanese,detail,sample,sample-jpn
a1-part2-0153,post,郵便,郵便・投稿・地位を表す。動詞では投稿する・配属する。 ,"Post the letter before noon.",a1-part2-0153_例文の日本語訳
a1-part2-0154,wall,壁,空間を仕切る立った面。障害の比喩にも使う。 ,"I hung the map on the wall.",a1-part2-0154_例文の日本語訳
a1-part2-0155,animal,動物,人間以外も含む生き物。性質としての動物性も表す。 ,"The animal left tracks in the snow.",a1-part2-0155_例文の日本語訳
a1-part2-0156,survey,調査,全体を見渡して調べること。アンケートの意味もある。 ,"The survey asked about commuting habits.",a1-part2-0156_例文の日本語訳
a1-part2-0157,really,本当に,事実であることや強調を表す副詞。驚きにも使う。 ,"The singer paused really before the chorus.",a1-part2-0157_例文の日本語訳
a1-part2-0158,judge,裁判官,判断する人。動詞では判断する・審査する。 ,"Workers need to judge the contract safely.",a1-part2-0158_例文の日本語訳
a1-part2-0159,minute,分,60分の1時間。形容詞では非常に小さい意味もある。 ,"Wait one minute before opening the door.",a1-part2-0159_例文の日本語訳
a1-part2-0160,drive,運転する,車を動かすイメージ。人を駆り立てる力も表す。 ,"Drive slowly through the village.",a1-part2-0160_例文の日本語訳
a1-part2-0161,hard,硬い,やわらかくない状態。難しい・一生懸命の意味もある。 ,"Hard ice covered the steps.",a1-part2-0161_例文の日本語訳
a1-part2-0162,today,今日,現在の日。現代・今の時代を表すこともある。 ,"Today the harbor smells of rain.",a1-part2-0162_例文の日本語訳
a1-part2-0163,tree,木,幹と枝を持つ植物。系統図の意味もある。 ,"A tree shaded the old bench.",a1-part2-0163_例文の日本語訳
a1-part2-0164,soon,すぐに,今からあまり時間がたたないうちに起こる感じ。 ,"The train will arrive soon.",a1-part2-0164_例文の日本語訳
a1-part2-0165,hospital,病院,病気やけがを治療する施設。入院の場も含む。 ,"The hospital opened a night clinic.",a1-part2-0165_例文の日本語訳
a1-part2-0166,break,～を壊す,一体のものを分ける・壊す。休憩の意味もある。 ,"Break the chocolate into pieces.",a1-part2-0166_例文の日本語訳
a1-part2-0167,top,いちばん上,一番高い部分。最高位・ふたの意味にも広がる。 ,"Write your name at the top.",a1-part2-0167_例文の日本語訳
a1-part2-0168,stop,～を止める,動きや行為を終わらせる。停留所の意味もある。 ,"Stop at the red sign.",a1-part2-0168_例文の日本語訳
a1-part2-0169,sit,座る,体をいすなどに置く。置かれている状態にも使う。 ,"Sit near the front row.",a1-part2-0169_例文の日本語訳
a1-part2-0170,moment,瞬間,とても短い時間。大事な時点を表すこともある。 ,"The moment passed quickly.",a1-part2-0170_例文の日本語訳
a1-part2-0171,big,大きい,サイズや量が大きい状態。重要な意味にも使う。 ,"A big truck blocked the lane.",a1-part2-0171_例文の日本語訳
a1-part2-0172,arm,腕,肩から手までの部分。武器・部門の意味もある。 ,"She carried the basket on her arm.",a1-part2-0172_例文の日本語訳
a1-part2-0173,island,島,水に囲まれた陸地。孤立した場所の比喩にもなる。 ,"The island appears only at low tide.",a1-part2-0173_例文の日本語訳
a1-part2-0174,door,ドア,出入り口を開閉するもの。機会への入り口の比喩もある。 ,"The door opened with a click.",a1-part2-0174_例文の日本語訳
a1-part2-0175,fine,元気な,問題なくよい状態。細かい・罰金の意味もある。 ,"The fine sand slipped through his fingers.",a1-part2-0175_例文の日本語訳
a1-part2-0176,happen,起こる,出来事が生じるイメージ。偶然そうなる意味もある。 ,"Children sometimes happen near the fountain.",a1-part2-0176_例文の日本語訳
a1-part2-0177,item,項目,一覧の一つ。品物・記事の一つを表す。 ,"Each item has a price tag.",a1-part2-0177_例文の日本語訳
a1-part2-0178,culture,文化,人々の生活様式や考え方。教養の意味もある。 ,"Culture shapes how people greet strangers.",a1-part2-0178_例文の日本語訳
a1-part2-0179,outside,外側,内側ではない場所。形容詞・副詞・前置詞で使う。 ,"Wait outside the door.",a1-part2-0179_例文の日本語訳
a1-part2-0180,bad,悪い,よくない状態。品質・行動・気分などに使う。 ,"Bad weather delayed the ferry.",a1-part2-0180_例文の日本語訳
a1-part2-0181,farm,農場,作物や家畜を育てる場所。動詞では農業をする。 ,"The farm grows pears and beans.",a1-part2-0181_例文の日本語訳
a1-part2-0182,box,箱,物を入れる四角い容器。区画や囲みの意味もある。 ,"Put the old photos in the box.",a1-part2-0182_例文の日本語訳
a1-part2-0183,parent,親,父または母。元になるもの・親会社の意味もある。 ,"The manager reviewed the parent before the meeting.",a1-part2-0183_例文の日本語訳
a1-part2-0184,copy,～を写す,同じものを作るイメージ。複写・部数の意味もある。 ,"Copy the address into your notebook.",a1-part2-0184_例文の日本語訳
a1-part2-0185,front,前面,物の前側。最前線・正面という意味もある。 ,"He waited at the front of the line.",a1-part2-0185_例文の日本語訳
a1-part2-0186,sea,海,広く塩水に覆われた場所。大量のものの比喩にもなる。 ,"The sea turned silver at dusk.",a1-part2-0186_例文の日本語訳
a1-part2-0187,anything,何でも,どんな物事でも。疑問・否定文でよく使う。 ,"Anything arrived early.",a1-part2-0187_例文の日本語訳
a1-part2-0188,wife,妻,結婚している女性の配偶者。夫との対になる語。 ,"His wife waited near the gate.",a1-part2-0188_例文の日本語訳
a1-part2-0189,boy,少年,男の子。親しみを込めた呼びかけにも使う。 ,"The boy carried a blue kite.",a1-part2-0189_例文の日本語訳
a1-part2-0190,difficult,難しい,理解や実行が簡単でない状態。扱いにくい人にも使う。 ,"The difficult climb took all morning.",a1-part2-0190_例文の日本語訳
a1-part2-0191,ten,10,数字の10。十個の数や順番を表す基本語。 ,"Ten guests arrived before noon.",a1-part2-0191_例文の日本語訳
a1-part2-0192,girl,女の子,若い女性・少女。親しい女性を指すこともある。 ,"The girl found a shell on the beach.",a1-part2-0192_例文の日本語訳
a1-part2-0193,visit,～を訪問する,人・場所を訪れるイメージ。名詞では訪問。 ,"Visit the temple at sunrise.",a1-part2-0193_例文の日本語訳
a1-part2-0194,ship,船,大きな船。動詞では発送する・輸送する意味もある。 ,"The ship left the harbor at dawn.",a1-part2-0194_例文の日本語訳
a1-part2-0195,sure,確信して,間違いないと思う状態。返答では「もちろん」。 ,"Are you sure the gate is locked?",a1-part2-0195_例文の日本語訳
a1-part2-0196,choose,～を選ぶ,複数の中から一つを決めるイメージ。 ,"Choose a seat near the aisle.",a1-part2-0196_例文の日本語訳
a1-part2-0197,wish,～を願う,現実と違うことや実現を望む気持ち。名詞では願い。 ,"Wish your brother luck before the test.",a1-part2-0197_例文の日本語訳
a1-part2-0198,walk,歩く,足でゆっくり進む。散歩・歩道の意味にもなる。 ,"Walk past the blue mailbox.",a1-part2-0198_例文の日本語訳
a1-part2-0199,store,店,商品を売る場所。動詞では蓄える・保存する。 ,"The store closed during the blackout.",a1-part2-0199_例文の日本語訳
a1-part2-0200,poor,貧しい,お金や資源が少ない状態。質が悪い意味もある。 ,"The team presented a poor plan.",a1-part2-0200_例文の日本語訳
