id,english,japanese,detail,sample,sample-jpn
a2-part7-0122,compromise,妥協,互いに譲り合う感覚。妥協案、危険にさらす意味もある。 ,"They reached a compromise.",彼らは妥協点に達した。
a2-part7-0123,silent,音がしない,「音がしない」という状態・性質を表す語。人・物の特徴・評価を表す。 ,"The library was silent except for turning pages.",図書館はページをめくる音以外は静かだった。
a2-part7-0124,resemble,～ に似ている,対象に働きかける動詞。「似ている」動作から抽象的用法にも広がる。 ,"The child does not resemble his father.",その子どもは父親に似ていない。
a2-part7-0125,technological,科学技術の,「科学技術の」という状態・性質を表す語。人・物の特徴・評価を表す。 ,"Technological progress changed how we work.",技術の進歩は私たちの仕事の仕方を変えた。
a2-part7-0126,deserve,～ に値する,対象に働きかける動詞。「値する」動作から抽象的用法にも広がる。 ,"You deserve a break.",あなたは休憩に値する。
a2-part7-0127,motive,動機,「動機」という状態・性質を表す語。人・物の特徴・評価を表す。 ,"Police searched for a motive.",警察は動機を調べた。
a2-part7-0128,resort,行楽地；（～に）訴える,最後に頼る手段が主な意味。行楽地という名詞にもなる。 ,"The island is a popular resort.",その島は人気のリゾート地だ。
a2-part7-0129,simultaneously,同時に,「同時に」様子を添える副詞。動作や文全体のニュアンスを変える。 ,"The two events happened simultaneously.",その2つの出来事は同時に起きた。
a2-part7-0130,habitat,生息地,「生息地」を指す基本語。物・考え・場面を具体的に表す。 ,"The forest is a habitat for bears.",森はクマの生息地だ。
a2-part7-0131,wildlife,野生生物,「野生生物」を指す基本語。物・考え・場面を具体的に表す。 ,"The park protects wildlife.",公園は野生動物を守っている。
a2-part7-0132,prejudice,先入観,「先入観」を指す基本語。物・考え・場面を具体的に表す。 ,"We must fight prejudice.",私たちは偏見と戦わなければならない。
a2-part7-0133,racial,人種の,「人種の」という状態・性質を表す語。人・物の特徴・評価を表す。 ,"Racial discrimination is illegal.",人種差別は違法だ。
a2-part7-0134,weakness,弱点、弱さ,動作・性質を名詞化した語。「弱点」という概念や結果を表す。 ,"His main weakness is poor time management.",彼の主な弱点は時間管理の下手さだ。
a2-part7-0135,unite,～ を結合させる,対象に働きかける動詞。「結合させる」動作から抽象的用法にも広がる。 ,"The crisis helped unite the community.",その危機がコミュニティを一つにするのに役立った。
a2-part7-0136,rational,道理にかなった,「道理にかなった」という状態・性質を表す語。人・物の特徴・評価を表す。 ,"We need a rational explanation for the decision.",私たちはその決定に対する合理的な説明が必要だ。
a2-part7-0137,totally,全く,「全く」様子を添える副詞。動作や文全体のニュアンスを変える。 ,"I totally agree with you.",私はあなたに全面的に同意する。
a2-part7-0138,inspire,～ を鼓舞する,対象に働きかける動詞。「鼓舞する」動作から抽象的用法にも広がる。 ,"Her story can inspire young athletes.",彼女の話は若いアスリートたちを刺激できる。
a2-part7-0139,historian,歴史家,「歴史家」という人・役割が主な意味。職業・立場・関係を表す。 ,"The historian studied ancient Rome.",その歴史家は古代ローマを研究した。
a2-part7-0140,disaster,災害,「災害」を指す基本語。物・考え・場面を具体的に表す。 ,"The earthquake was a disaster.",その地震は災害だった。
a2-part7-0141,whisper,ささやく,「ささやく」という動きや変化を表す語。人・物の状態変化にも使う。 ,"She spoke in a whisper.",彼女はひそひそ声で話した。
a2-part7-0142,anger,怒り,「怒り」を指す基本語。物・考え・場面を具体的に表す。 ,"Anger flashed across his face.",怒りが彼の顔に浮かんだ。
a2-part7-0143,pale,青白い,「青白い」を指す基本語。物・考え・場面を具体的に表す。 ,"Her face looked pale after the shock.",彼女の顔はショックの後に青ざめていた。
a2-part7-0144,reputation,評判,動作・性質を名詞化した語。「評判」という概念や結果を表す。 ,"The restaurant has a good reputation.",そのレストランは評判が良い。
a2-part7-0145,extraordinary,並はずれた,「並はずれた」という状態・性質を表す語。人・物の特徴・評価を表す。 ,"The firefighter showed extraordinary courage.",消防士は並外れた勇気を見せた。
a2-part7-0146,stir,～ をかき混ぜる,対象に働きかける動詞。「かき混ぜる」動作から抽象的用法にも広がる。 ,"Stir the soup with a spoon.",スープをスプーンでかき混ぜてください。
a2-part7-0147,inhabitant,住人,「住人」という状態・性質を表す語。人・物の特徴・評価を表す。 ,"Each inhabitant received a notice.",各住民が通知を受け取った。
a2-part7-0148,historic,歴史に残る,歴史に残るほど重要な感覚。historicalとの違いに注意。 ,"They visited a historic castle.",彼らは歴史的な城を訪れた。
a2-part7-0149,residential,住居の,「住居の」という状態・性質を表す語。人・物の特徴・評価を表す。 ,"This is a quiet residential area.",ここは静かな住宅地だ。
a2-part7-0150,biology,生物学,「生物学」を指す基本語。物・考え・場面を具体的に表す。 ,"She studies biology at university.",彼女は大学で生物学を学んでいる。
a2-part7-0151,northwest,北西,「北西」を指す基本語。物・考え・場面を具体的に表す。 ,"The town lies northwest of Tokyo.",その町は東京の北西に位置する。
a2-part7-0152,barrel,たる,「たる」という動きや変化を表す語。人・物の状態変化にも使う。 ,"The barrel was full of rainwater.",樽は雨水でいっぱいだった。
a2-part7-0153,delight,大喜び,「大喜び」を指す基本語。物・考え・場面を具体的に表す。 ,"The music filled her with delight.",音楽は彼女に喜びをもたらした。
a2-part7-0154,seize,～ をぐいとつかむ,対象に働きかける動詞。「ぐいとつかむ」動作から抽象的用法にも広がる。 ,"Police tried to seize the stolen goods.",警察は盗まれた品物を押収しようとした。
a2-part7-0155,disturbance,乱すこと,動作・性質を名詞化した語。「乱す」という概念や結果を表す。 ,"The loud music caused a disturbance.",大きな音楽が騒乱を引き起こした。
a2-part7-0156,productive,生産的な,「生産的な」という状態・性質を表す語。人・物の特徴・評価を表す。 ,"The productive meeting produced three clear decisions.",実りある会議から3つの明確な決定が生まれた。
a2-part7-0157,pit,地面の穴,「地面の穴」を指す基本語。物・考え・場面を具体的に表す。 ,"He dug a pit in the ground.",彼は地面に穴を掘った。
a2-part7-0158,collapse,つぶれる,「つぶれる」という動きや変化を表す語。人・物の状態変化にも使う。 ,"The old bridge may collapse.",古い橋が崩れるかもしれない。
a2-part7-0159,highlight,最も明るい部分,最も目立つ部分が主な意味。強調する動詞にも使う。 ,"Winning the prize was the highlight of the trip.",賞を受賞したことがその旅のハイライトだった。
a2-part7-0160,immigration,移住,動作・性質を名詞化した語。「移住」という概念や結果を表す。 ,"Immigration changed the city's culture.",移民が都市の文化を変えた。
a2-part7-0161,sacred,神聖な,「神聖な」という状態・性質を表す語。人・物の特徴・評価を表す。 ,"The temple is a sacred place.",その寺院は神聖な場所だ。
a2-part7-0162,altogether,まったく,「まったく」様子を添える副詞。動作や文全体のニュアンスを変える。 ,"Altogether, we spent three hours there.",全部で3時間をそこで過ごした。
a2-part7-0163,complicate,～ を複雑にする,対象に働きかける動詞。「複雑にする」動作から抽象的用法にも広がる。 ,"Too many rules complicate the process.",規則が多すぎるとプロセスが複雑になる。
a2-part7-0164,companion,仲間,「仲間」という人・役割が主な意味。職業・立場・関係を表す。 ,"My dog is a loyal companion.",私の犬は忠実な仲間だ。
a2-part7-0165,signature,署名,「署名」を指す基本語。物・考え・場面を具体的に表す。 ,"Please write your signature here.",ここにサインをしてください。
a2-part7-0166,react,反応する,「反応する」という動きや変化を表す語。人・物の状態変化にも使う。 ,"How did she react to the news?",彼女はそのニュースにどう反応しましたか？
a2-part7-0167,preservation,保護,動作・性質を名詞化した語。「保護」という概念や結果を表す。 ,"Food preservation prevents waste.",食品の保存は無駄を防ぐ。
a2-part7-0168,personally,自分自身で,「自分自身で」様子を添える副詞。動作や文全体のニュアンスを変える。 ,"I personally prefer tea.",私は個人的にはお茶の方が好きだ。
a2-part7-0169,clinic,診療所,「診療所」という状態・性質を表す語。人・物の特徴・評価を表す。 ,"The clinic treats children with allergies.",そのクリニックはアレルギーを持つ子どもたちを治療する。
a2-part7-0170,massive,大きくて重い,「大きくて重い」という状態・性質を表す語。人・物の特徴・評価を表す。 ,"A massive rock blocked the road.",大きな岩が道を塞いでいた。
a2-part7-0171,darkness,暗さ,動作・性質を名詞化した語。「暗さ」という概念や結果を表す。 ,"The room was filled with darkness.",部屋は暗闇に包まれていた。
a2-part7-0172,protective,保護の,「保護の」という状態・性質を表す語。人・物の特徴・評価を表す。 ,"Wear protective glasses.",保護メガネを着用してください。
a2-part7-0173,surgeon,外科医,「外科医」という人・役割が主な意味。職業・立場・関係を表す。 ,"The surgeon performed the operation.",外科医が手術を行った。
a2-part7-0174,intense,激しい,「激しい」という状態・性質を表す語。人・物の特徴・評価を表す。 ,"The intense heat made us tired.",激しい暑さで私たちは疲れてしまった。
a2-part7-0175,palm,手のひら,手のひらが主な意味。ヤシの木という意味もある。 ,"She held the coin in her palm.",彼女は手のひらにコインを握っていた。
a2-part7-0176,definitely,明確に,「明確に」様子を添える副詞。動作や文全体のニュアンスを変える。 ,"I definitely agree with you.",私は確かにあなたに同意する。
a2-part7-0177,enclose,～ を囲む,対象に働きかける動詞。「囲む」動作から抽象的用法にも広がる。 ,"Please enclose a copy of the receipt.",領収書のコピーを同封してください。
a2-part7-0178,indirect,真っすぐでない,「真っすぐでない」という状態・性質を表す語。人・物の特徴・評価を表す。 ,"He gave an indirect answer to the question.",彼は質問に間接的な答えをした。
a2-part7-0179,instructor,教師,「教師」という人・役割が主な意味。職業・立場・関係を表す。 ,"The instructor explained the safety rules.",教官が安全規則を説明した。
a2-part7-0180,fragment,破片,「破片」という状態・性質を表す語。人・物の特徴・評価を表す。 ,"A fragment of glass lay on the floor.",ガラスの破片が床に落ちていた。
a2-part7-0181,departure,立ち去ること,「立ち去る」を指す基本語。物・考え・場面を具体的に表す。 ,"Our departure was delayed by rain.",私たちの出発は雨のために遅れた。
a2-part7-0182,renew,～ を新しくする,対象に働きかける動詞。「新しくする」動作から抽象的用法にも広がる。 ,"I need to renew my passport.",パスポートを更新する必要がある。
a2-part7-0183,tiny,とても小さい,非常に小さいイメージ。little より強意で、サイズや量の小ささを表す形容詞。,"A tiny bird sat on the branch.",小さな鳥が枝に止まっていた。
a2-part7-0184,worthy,価値のある,価値や資格がある感覚。尊敬・注目に値する意味で使う。 ,"The project is worthy of support.",そのプロジェクトは支援に値する。
a2-part7-0185,pot,鍋、つぼ,深めの容器が主な意味。鍋・つぼ・鉢など広く使う。 ,"The soup boiled in a large pot.",スープが大きな鍋で沸いていた。
a2-part7-0186,proud,誇りに思う,「誇りに思う」という動きや変化を表す語。人・物の状態変化にも使う。 ,"She felt proud of her hard work.",彼女は自分の努力を誇りに思った。
a2-part7-0187,scan,ざっと見る、スキャンする,「ざっと見る」という動きや変化を表す語。人・物の状態変化にも使う。 ,"Scan the document before sending it.",送る前にドキュメントをスキャンしてください。
a2-part7-0188,glory,栄光,「栄光」という状態・性質を表す語。人・物の特徴・評価を表す。 ,"The team dreamed of glory.",チームは栄光を夢見ていた。
a2-part7-0189,broadcast,～ を放送する,広く電波や情報を流す感覚。放送・配信で使う。 ,"The station will broadcast the game live.",その放送局は試合を生中継する。
a2-part7-0190,equality,等しいこと,動作・性質を名詞化した語。「等しい」という概念や結果を表す。 ,"The law promotes equality for all citizens.",法律はすべての市民の平等を促進する。
a2-part7-0191,widespread,広範囲にわたる,「広範囲にわたる」という動きや変化を表す語。人・物の状態変化にも使う。 ,"Widespread rain is expected tomorrow.",明日は広範囲で雨が予想される。
a2-part7-0192,loud,大きな音の,「大きな音の」という状態・性質を表す語。人・物の特徴・評価を表す。 ,"A loud bell echoed through the hall.",大きなベルの音がホールに響き渡った。
a2-part7-0193,somehow,どうにかして,「どうにかして」様子を添える副詞。動作や文全体のニュアンスを変える。 ,"Somehow, we arrived on time.",どういうわけか、私たちは時間通りに到着した。
a2-part7-0194,fellow,仲間、同僚,「仲間」という人・役割が主な意味。職業・立場・関係を表す。 ,"He helped a fellow student.",彼は仲間の学生を助けた。
a2-part7-0195,nutrition,栄養,動作・性質を名詞化した語。「栄養」という概念や結果を表す。 ,"Good nutrition is important for children.",良い栄養は子どもたちにとって重要だ。
a2-part7-0196,wrap,～ を巻きつける,対象に働きかける動詞。「巻きつける」動作から抽象的用法にも広がる。 ,"Wrap the gift in blue paper.",青い紙でプレゼントを包んでください。
a2-part7-0197,crush,～ を押しつぶす,対象に働きかける動詞。「押しつぶす」動作から抽象的用法にも広がる。 ,"Crush the garlic before cooking.",調理する前にニンニクを潰してください。
a2-part7-0198,appreciation,正しく認識すること,動作・性質を名詞化した語。「正しく認識」という概念や結果を表す。 ,"She showed appreciation for their hard work.",彼女は彼らの懸命な働きへの感謝を示した。
a2-part7-0199,peculiar,変わった、独特の,「変わった」という状態・性質を表す語。人・物の特徴・評価を表す。 ,"He has a peculiar way of speaking.",彼は変わった話し方をする。
a2-part7-0200,organ,臓器、オルガン,体の器官が主な意味。楽器のオルガンの意味もある。 ,"The heart is an organ that pumps blood.",心臓は血液を送り出す臓器だ。
