id,english,japanese,detail,sample,sample-jpn
b1-part3-0120,ashamed,恥じている,「恥じている」を表す語。動きや変化を表し、比喩にも広がる。 ,"He felt ashamed of his behavior.",彼は自分の行動を恥じた。
b1-part3-0121,knit,編む、結びつく,「編む」を表す語。動きや変化を表し、比喩にも広がる。 ,"My grandmother can knit a sweater.",祖母はセーターを編むことができる。
b1-part3-0122,honesty,正直,「正直」を表す語。人・物の性質・状態を表す形容詞。 ,"Honesty builds trust.",誠実さは信頼を築く。
b1-part3-0123,keyboard,キーボード,具体的な物・場所を指す語。「キーボード」を場面の名詞として使う。 ,"Type the password on the keyboard.",キーボードでパスワードを入力しなさい。
b1-part3-0124,disastrous,悲惨な,「悲惨な」を表す語。人・物の性質・状態を表す形容詞。 ,"The plan had disastrous results.",その計画は惨憺たる結果をもたらした。
b1-part3-0125,awkward,気まずい、不器用な,「気まずい」を表す語。具体的な意味から、抽象的な使い方にも広がる。 ,"The silence felt awkward.",沈黙が気まずく感じられた。
b1-part3-0126,turbulence,乱気流、混乱,「乱気流」を表す語。行為・過程・結果を名詞で表す。 ,"The plane shook during turbulence.",乱気流で飛行機が揺れた。
b1-part3-0127,misunderstanding,誤解,「誤解」を表す語。人・物の性質・状態を表す形容詞。 ,"A misunderstanding caused the argument.",誤解が口論の原因となった。
b1-part3-0128,skeleton,骨格、骨組み,具体的な物・場所を指す語。「骨格」を場面の名詞として使う。 ,"The skeleton supports the body.",骨格は体を支える。
b1-part3-0129,beautifully,美しく,「美しく」を表す語。動きや変化を表し、比喩にも広がる。 ,"She sang beautifully at the concert.",彼女はコンサートで美しく歌った。
b1-part3-0130,respectable,立派な、かなりの,「立派な」を表す語。人・物の性質・状態を表す形容詞。 ,"He found a respectable job.",彼は立派な仕事を見つけた。
b1-part3-0131,shiver,震える,「震える」を表す語。動きや変化を表し、比喩にも広がる。 ,"The cold wind made me shiver.",冷たい風で体が震えた。
b1-part3-0132,biochemistry,生化学,「生化学」を表す語。人・物の性質・状態を表す形容詞。 ,"Biochemistry examines chemical processes in living cells.",生化学は生きた細胞の化学的プロセスを研究する。
b1-part3-0133,experienced,経験豊富な,「経験豊富な」を表す語。人・物の性質・状態を表す形容詞。 ,"An experienced nurse helped him.",経験豊富な看護師が彼を助けた。
b1-part3-0134,rewrite,～ を書き直す,「書き直す」を表す語。動きや変化を表し、比喩にも広がる。 ,"Please rewrite the paragraph in simpler English.",その段落をより簡単な英語で書き直してください。
b1-part3-0135,congratulate,～ を祝う,「祝う」を表す語。動きや変化を表し、比喩にも広がる。 ,"I will congratulate her on the award.",彼女の受賞をお祝いします。
b1-part3-0136,calf,子牛、ふくらはぎ,子牛と脚のふくらはぎを表す。文脈で判別する語。 ,"The calf drank milk from its mother.",子牛は母親からミルクを飲んだ。
b1-part3-0137,needle,針,具体的な物・場所を指す語。「針」を場面の名詞として使う。 ,"Thread the needle carefully.",丁寧に針に糸を通しなさい。
b1-part3-0138,cautious,用心深い,「用心深い」を表す語。人・物の性質・状態を表す形容詞。 ,"Be cautious on the icy road.",凍った道路では注意しなさい。
b1-part3-0139,bump,ぶつかる、こぶ,「ぶつかる」を表す語。動きや変化を表し、比喩にも広がる。 ,"There is a bump on my forehead.",額にこぶができた。
b1-part3-0140,apology,謝罪,「謝罪」を表す語。人・物の性質・状態を表す形容詞。 ,"She offered a sincere apology.",彼女は心からの謝罪をした。
b1-part3-0141,worthwhile,価値のある,「価値のある」を表す語。動きや変化を表し、比喩にも広がる。 ,"Volunteering at the shelter was worthwhile.",シェルターでのボランティア活動はやりがいがあった。
b1-part3-0142,cherish,～ を大切にする,「大切にする」を表す語。動きや変化を表し、比喩にも広がる。 ,"I cherish memories of my childhood.",子ども時代の思い出を大切にしている。
b1-part3-0143,homeless,家のない,「家のない」を表す語。人・物の性質・状態を表す形容詞。 ,"The homeless man found shelter.",ホームレスの男性は避難場所を見つけた。
b1-part3-0144,continual,たびたび起こる,「たびたび起こる」を表す語。動きや変化を表し、比喩にも広がる。 ,"The continual noise kept us awake.",絶え間ない騒音で眠れなかった。
b1-part3-0145,ambulance,救急車,「救急車」を表す語。行為・過程・結果を名詞で表す。 ,"An ambulance took him to the hospital.",救急車が彼を病院に運んだ。
b1-part3-0146,depressed,落ち込んだ、不景気の,「落ち込んだ」を表す語。人・物の性質・状態を表す形容詞。 ,"He felt depressed after losing his job.",彼は仕事を失ってふさぎ込んだ。
b1-part3-0147,supposedly,たぶん、～だとされて,「たぶん」を表す語。動作・状態の程度や方向を補う副詞的な語。 ,"The train is supposedly delayed by snow.",電車は雪のため遅延しているらしい。
b1-part3-0148,emotionally,感情的に,「感情的に」を表す語。動作・状態の程度や方向を補う副詞的な語。 ,"The speech affected her emotionally.",そのスピーチは彼女に感情的な影響を与えた。
b1-part3-0149,pronoun,代名詞,文法・語形成の用語。「代名詞」として語や文の働きを表す。 ,"A pronoun can replace a noun in a sentence.",代名詞は文中で名詞の代わりになる。
b1-part3-0150,hopefully,願わくは、希望をもって,「願わくは」を表す語。動作・状態の程度や方向を補う副詞的な語。 ,"Hopefully, the rain will stop soon.",うまくいけば、雨がすぐに止むでしょう。
b1-part3-0151,tile,タイル,具体的な物・場所を指す語。「タイル」を場面の名詞として使う。 ,"The kitchen floor has blue tile.",台所の床には青いタイルが貼ってある。
b1-part3-0152,selfish,利己的な,「利己的な」を表す語。具体的な意味から、抽象的な使い方にも広がる。 ,"A selfish person thinks only of himself.",わがままな人は自分のことしか考えない。
b1-part3-0153,shrimp,エビ,具体的な物・場所を指す語。「エビ」を場面の名詞として使う。 ,"We ate shrimp for dinner.",夕食にエビを食べた。
b1-part3-0154,headline,見出し,「見出し」を表す語。具体的な意味から、抽象的な使い方にも広がる。 ,"The headline caught my attention.",見出しが私の注意を引いた。
b1-part3-0155,tumble,転ぶ、急落する,「転ぶ」を表す語。動きや変化を表し、比喩にも広がる。 ,"The child took a tumble on the grass.",子どもが芝生で転んだ。
b1-part3-0156,queue,列、列に並ぶ,「列」を表す語。具体的な意味から、抽象的な使い方にも広がる。 ,"People waited in a long queue.",人々は長い列に並んで待った。
b1-part3-0157,greeting,あいさつ,「あいさつ」を表す語。動きや変化を表し、比喩にも広がる。 ,"She gave me a warm greeting.",彼女は温かく迎えてくれた。
b1-part3-0158,handy,便利な、手元にある,「便利な」を表す語。人・物の性質・状態を表す形容詞。 ,"This small tool is handy for repairs.",この小さな道具は修理に重宝する。
b1-part3-0159,antique,骨とう品、古風な,「骨とう品」を表す語。具体的な意味から、抽象的な使い方にも広がる。 ,"She bought an antique chair.",彼女はアンティークの椅子を買った。
b1-part3-0160,fond,好きで、愛情のある,「好きで」を表す語。人の性質・感情・状態を表す抽象語。 ,"She is fond of classical music.",彼女はクラシック音楽が好きだ。
b1-part3-0161,chuckle,くすくす笑う,「くすくす笑う」を表す語。動きや変化を表し、比喩にも広がる。 ,"He gave a quiet chuckle.",彼は静かにクスクス笑った。
b1-part3-0162,magical,魔法のような,「魔法のような」を表す語。人・物の性質・状態を表す形容詞。 ,"The magician used a magical spell.",魔法使いは魔法の呪文を使った。
b1-part3-0163,oppress,～ を抑圧する,「抑圧する」を表す語。動きや変化を表し、比喩にも広がる。 ,"The regime tried to oppress its people.",その政権は国民を弾圧しようとした。
b1-part3-0164,gossip,うわさ話,「うわさ話」を表す語。人の性質・感情・状態を表す抽象語。 ,"Office gossip spreads quickly.",職場の噂はすぐに広まる。
b1-part3-0165,inscribe,～ を刻む、記す,「刻む」を表す語。動きや変化を表し、比喩にも広がる。 ,"They will inscribe her name on the trophy.",彼らは彼女の名前をトロフィーに刻む予定だ。
b1-part3-0166,applause,拍手喝采,「拍手喝采」を表す語。具体的な意味から、抽象的な使い方にも広がる。 ,"The speech received loud applause.",そのスピーチは大きな拍手を受けた。
b1-part3-0167,baggage,手荷物、心の重荷,「手荷物」を表す語。状態やまとまりを名詞で表す。 ,"The baggage was loaded onto the bus.",荷物はバスに積み込まれた。
b1-part3-0168,consonant,子音,文法・語形成の用語。「子音」として語や文の働きを表す。 ,"The word begins with a consonant.",その単語は子音から始まる。
b1-part3-0169,jealous,嫉妬深い,「嫉妬深い」を表す語。人・物の性質・状態を表す形容詞。 ,"She felt jealous of her sister's success.",彼女は妹の成功を羨んだ。
b1-part3-0170,swarm,群れ、群がる,「群れ」を表す語。具体的な意味から、抽象的な使い方にも広がる。 ,"A swarm of bees flew from the tree.",蜂の群れが木から飛び立った。
b1-part3-0171,sour,酸っぱい、不機嫌な,具体的な物・場所を指す語。「酸っぱい」を場面の名詞として使う。 ,"The lemon tasted sour.",レモンは酸っぱい味がした。
b1-part3-0172,bounce,弾む、跳ね返る,「弾む」を表す語。動きや変化を表し、比喩にも広がる。 ,"The ball began to bounce.",ボールが弾み始めた。
b1-part3-0173,bust,～ を壊す、胸像,壊す・破産する意味と、胸像・胸部の名詞用法がある。 ,"Police tried to bust the drug ring.",警察は麻薬組織の摘発を試みた。
b1-part3-0174,eternity,永遠,「永遠」を表す語。性質・立場・関係を名詞で表す。 ,"The wait felt like an eternity.",待ち時間が永遠のように感じられた。
b1-part3-0175,blush,赤面する,「赤面する」を表す語。動きや変化を表し、比喩にも広がる。 ,"She began to blush with embarrassment.",彼女は恥ずかしさで顔を赤らめ始めた。
b1-part3-0176,embarrassment,困惑,「困惑」を表す語。行為・過程・結果を名詞で表す。 ,"He laughed to hide his embarrassment.",彼は恥ずかしさを隠すために笑った。
b1-part3-0177,cheerful,陽気な,「陽気な」を表す語。人・物の性質・状態を表す形容詞。 ,"She greeted us with a cheerful smile.",彼女は明るい笑顔で私たちを迎えた。
b1-part3-0178,scenic,景色のよい,「景色のよい」を表す語。人・物の性質・状態を表す形容詞。 ,"We drove along a scenic coastal road.",私たちは景色の美しい海岸沿いの道を車で走った。
b1-part3-0179,lamb,子羊,「子羊」を表す語。具体的な意味から、抽象的な使い方にも広がる。 ,"The lamb followed its mother.",子羊は母親の後をついていった。
b1-part3-0180,earnest,真剣な,具体的な物・場所を指す語。「真剣な」を場面の名詞として使う。 ,"He made an earnest effort.",彼は誠実な努力をした。
b1-part3-0181,chronological,年代順の,「年代順の」を表す語。人・物の性質・状態を表す形容詞。 ,"List the events in chronological order.",出来事を時系列順にリストアップしなさい。
b1-part3-0182,reclaim,～ を取り戻す、再生する,「取り戻す」を表す語。動きや変化を表し、比喩にも広がる。 ,"The city plans to reclaim old industrial land.",市は古い工業用地を再開発する計画だ。
b1-part3-0183,flute,フルート,「フルート」を表す語。具体的な意味から、抽象的な使い方にも広がる。 ,"She played the flute in the band.",彼女はバンドでフルートを演奏した。
b1-part3-0184,runway,滑走路,「滑走路」を表す語。人・物の性質・状態を表す形容詞。 ,"The plane waited on the runway.",飛行機は滑走路で待機していた。
b1-part3-0185,mourn,～ を悼む,「悼む」を表す語。動きや変化を表し、比喩にも広がる。 ,"The family will mourn their loss.",家族はその死を悼む。
b1-part3-0186,proverb,ことわざ,「ことわざ」を表す語。具体的な意味から、抽象的な使い方にも広がる。 ,"The proverb warns against careless promises.",そのことわざは軽率な約束を戒めている。
b1-part3-0187,horizon,地平線、視野,具体的な物・場所を指す語。「地平線」を場面の名詞として使う。 ,"The sun sank below the horizon.",太陽が地平線の下に沈んだ。
b1-part3-0188,tongue,舌、言語,具体的な物・場所を指す語。「舌」を場面の名詞として使う。 ,"I burned my tongue on the hot soup.",熱いスープで舌を火傷した。
b1-part3-0189,actress,女優,「女優」を表す語。具体的な意味から、抽象的な使い方にも広がる。 ,"The actress performed on stage.",その女優は舞台で演じた。
b1-part3-0190,prefix,接頭辞,文法・語形成の用語。「接頭辞」として語や文の働きを表す。 ,"Add the prefix to the word.",その単語に接頭辞を加えなさい。
b1-part3-0191,slogan,標語,「標語」を表す語。具体的な意味から、抽象的な使い方にも広がる。 ,"The campaign used a short slogan.",そのキャンペーンは短いスローガンを使った。
b1-part3-0192,tease,～ をからかう,「からかう」を表す語。動きや変化を表し、比喩にも広がる。 ,"Do not tease younger children.",年下の子どもをからかってはいけない。
b1-part3-0193,strangely,奇妙に,「奇妙に」を表す語。動作・状態の程度や方向を補う副詞的な語。 ,"The machine behaved strangely after the repair.",修理後、機械は奇妙な動きをした。
b1-part3-0194,diligence,勤勉,「勤勉」を表す語。行為・過程・結果を名詞で表す。 ,"Diligence helped her pass the exam.",勤勉さのおかげで彼女は試験に合格した。
b1-part3-0195,bilingual,二言語を使う,「二言語を使う」を表す語。動きや変化を表し、比喩にも広がる。 ,"She is bilingual in Japanese and English.",彼女は日本語と英語のバイリンガルだ。
b1-part3-0196,hopeless,望みのない,「望みのない」を表す語。人・物の性質・状態を表す形容詞。 ,"The situation looked hopeless.",状況は絶望的に見えた。
b1-part3-0197,hopeful,希望に満ちた,「希望に満ちた」を表す語。人・物の性質・状態を表す形容詞。 ,"We are hopeful about the future.",私たちは将来に希望を持っている。
b1-part3-0198,charity,慈善、慈善団体,「慈善」を表す語。性質・立場・関係を名詞で表す。 ,"The charity collects coats for children.",その慈善団体は子どもたちのためのコートを集めている。
b1-part3-0199,cabbage,キャベツ,「キャベツ」を表す語。状態やまとまりを名詞で表す。 ,"She chopped cabbage for the soup.",彼女はスープ用にキャベツを刻んだ。
b1-part3-0200,careless,不注意な,「不注意な」を表す語。人・物の性質・状態を表す形容詞。 ,"A careless mistake cost him points.",不注意なミスで彼は点数を失った。
